,DOI,KeyWords,fund,public_date,title,author,author info,abstract,type,jounary,category
124,10.1007/s00330-020-06827-4,作者关键词:Coronavirus; Pneumonia; Diagnostic imaging; Multidetector computed tomography; Mass chest X-ray,Construction of Key Laboratory (Cultivation) of Chinese Academy of Medical Sciences ,APR 2020,The role of imaging in 2019 novel coronavirus pneumonia (COVID-19),"作者:Yang, WJ (Yang, Wenjing)[ 1,2,3 ] ; Sirajuddin, A (Sirajuddin, Arlene)[ 4 ] ; Zhang, XC (Zhang, Xiaochun)[ 3 ] ; Liu, GS (Liu, Guanshu)[ 5 ] ; Teng, ZZ (Teng, Zhongzhao)[ 6,7 ] ; Zhao, SH (Zhao, Shihua)[ 1 ] ; Lu, MJ (Lu, Minjie)[ 1,4,8 ]","Chinese Acad Med Sci & Peking Union Med Coll, Fuwai Hosp, Natl Ctr Cardiovasc Dis, Dept Magnet Resonance Imaging, 167 Beilishi Rd, Beijing 100037, Peoples R China.
NHLBI, Dept Hlth & Human Serv, NIH, Bethesda, MD 20892 USA.
Chinese Acad Med Sci, Key Lab Cardiovasc Imaging Cultivat, Beijing 100037, Peoples R China.
[ 1 ] Chinese Acad Med Sci & Peking Union Med Coll, Fuwai Hosp, Natl Ctr Cardiovasc Dis, Dept Magnet Resonance Imaging, 167 Beilishi Rd, Beijing 100037, Peoples R China
[ 2 ] Wuhan Univ, Dept Clin Med, Wuhan 430071, Hubei, Peoples R China
[ 3 ] Wuhan Univ, Zhongnan Hosp, Dept Radiol, Wuhan 430071, Hubei, Peoples R China
[ 4 ] NHLBI, Dept Hlth & Human Serv, NIH, Bethesda, MD 20892 USA
[ 5 ] Johns Hopkins Univ, Sch Med, Dept Radiol, Baltimore, MD 21205 USA
[ 6 ] Univ Cambridge, Dept Radiol, Cambridge, England
[ 7 ] Univ Cambridge, Dept Engn, Cambridge CB2 1TN, England
[ 8 ] Chinese Acad Med Sci, Key Lab Cardiovasc Imaging Cultivat, Beijing 100037, Peoples R China
","摘要
Almost the entire world, not only China, is currently experiencing the outbreak of a novel coronavirus that causes respiratory disease, severe pneumonia, and even death. The outbreak began in Wuhan, China, in December of 2019 and is currently still ongoing. This novel coronavirus is highly contagious and has resulted in a continuously increasing number of infections and deaths that have already surpassed the SARS-CoV outbreak that occurred in China between 2002 and 2003. It is now officially a pandemic, announced by WHO on the 11th of March. Currently, the 2019 novel coronavirus (SARS-CoV-2) can be identified by virus isolation or viral nucleic acid detection; however, false negatives associated with the nucleic acid detection provide a clinical challenge and thus make the imaging examination crucial. Imaging exams have been a main clinical diagnostic criteria for the 2019 novel coronavirus disease (COVID-19) in China. Imaging features of multiple patchy areas of ground glass opacity and consolidation predominately in the periphery of the lungs are characteristic manifestations on chest CT and extremely helpful in the early detection and diagnosis of this disease, which aids prompt diagnosis and the eventual control of this emerging global health emergency. Key Points center dot In December 2019, China, an outbreak of pneumonia caused by a novel, highly contagious coronavirus raised grave concerns and posed a huge threat to global public health. center dot Among the infected patients, characteristic findings on CT imaging include multiple, patchy, ground-glass opacity, crazy-paving pattern, and consolidation shadows, mainly distributed in the peripheral and subpleural areas of both lungs, which are very helpful for the frontline clinicians. center dot Imaging examination has become the indispensable means not only in the early detection and diagnosis but also in monitoring the clinical course, evaluating the disease severity, and may be presented as an important warning signal preceding the negative RT-PCR test results.",文献类型:Article; Early Access,EUROPEAN RADIOLOGY,"研究方向:Radiology, Nuclear Medicine & Medical Imaging"
125,10.1080/14712598.2020.1752177,作者关键词:SARS-CoV-2 virus; plantibody; biomanufacturing; COVID-19 vaccine; mucosal immunization,,APR 2020,Will plant-made biopharmaceuticals play a role in the fight against COVID-19?,"作者:Rosales-Mendoza, S (Rosales-Mendoza, Sergio)[ 1,2 ]","Univ Autonoma San Luis Potosi, Fac Ciencias Quim, Ave Dr Manuel Nava 6, San Luis Potosi 78210, San Luis Potosi, Mexico.
[ 1 ] Univ Autonoma San Luis Potosi, Fac Ciencias Quim, Ave Dr Manuel Nava 6, San Luis Potosi 78210, San Luis Potosi, Mexico
[ 2 ] Univ Autonoma San Luis Potosi, Secc Biotecnol, Ctr Invest Ciencias Salud & Biomed, San Luis Potosi, San Luis Potosi, Mexico
","摘要
Given the dramatic impact of the COVID-19 pandemic, it is imperative to divulge all the available technologies with the potential to fight against this virus. Plant biotechnology offers potential solutions to this pandemic through the development of low-cost vaccines and antibodies useful for therapy, prophylaxis, and diagnosis. The technology to produce plant-made biopharmaceuticals is already established; two examples of these are: a therapeutic enzyme that has entered the market and the influenza vaccines that are currently under clinical trials with encouraging results. Thus far, some companies have started developing anti-COVID-19 antibodies and vaccines. In particular, plant-made antibodies might be timely produced and approved for human use in the short term, while the development of vaccines will take longer time (clinical evaluations could be concluded by the end of 2021); nonetheless, the candidates obtained will be valuable tools for future outbreaks. The key aspects that will define the exploitation of this technology in the fight against COVID-19 are discussed.",文献类型:Editorial Material; Early Access,EXPERT OPINION ON BIOLOGICAL THERAPY,研究方向:Biotechnology & Applied Microbiology; Research & Experimental Medicine
126,10.1038/s41577-020-0312-7,,German Research Foundation (DFG),APR 2020,COVID-19: risk for cytokine targeting in chronic inflammatory diseases?,"作者:Schett, G (Schett, Georg)[ 1,2,3 ] ; Sticherling, M (Sticherling, Michael)[ 2,3,4 ] ; Neurath, MF (Neurath, Markus F.)[ 2,3,5 ]","FAU Erlangen Nuremberg, Dept Internal Med 3, Erlangen, Germany.
Univ Klinikum Erlangen, Erlangen, Germany.
FAU Erlangen Nuremberg, DZI, Erlangen, Germany.
[ 1 ] FAU Erlangen Nuremberg, Dept Internal Med 3, Erlangen, Germany
[ 2 ] Univ Klinikum Erlangen, Erlangen, Germany
[ 3 ] FAU Erlangen Nuremberg, DZI, Erlangen, Germany
[ 4 ] FAU Erlangen Nuremberg, Dept Dermatol, Erlangen, Germany
[ 5 ] FAU Erlangen Nuremberg, Dept Internal Med 1, Erlangen, Germany
","摘要
COVID-19, caused by the SARS-CoV-2 virus, has become pandemic. With sharply rising infection rates, patient groups characterized by an enhanced infection risk will be challenged by the virus. In this context, patients with chronic immune-mediated inflammatory diseases are of particular interest, as these diseases are characterized by an intrinsic immune dysfunction leading to inflammation that may enhance risk for severe infection.",文献类型:Editorial Material; Early Access,NATURE REVIEWS IMMUNOLOGY,研究方向:Immunology
127,10.1007/s11739-020-02331-1,作者关键词:SARS-CoV-2; COVID-19; VKA; DOAC; LMWH,,APR 2020,Switch from oral anticoagulants to parenteral heparin in SARS-CoV-2 hospitalized patients,"作者:Testa, S (Testa, Sophie)[ 1 ] ; Paoletti, O (Paoletti, Oriana)[ 1 ] ; Giorgi-Pierfranceschi, M (Giorgi-Pierfranceschi, Matteo)[ 2 ] ; Pan, A (Pan, Angelo)[ 3 ]","Cremona Hosp, Haemostasis & Thrombosis Ctr, Viale Concordia 1, I-26100 Cremona, Italy.
[ 1 ] Cremona Hosp, Haemostasis & Thrombosis Ctr, Viale Concordia 1, I-26100 Cremona, Italy
[ 2 ] Cremona Hosp, Div Internal Med, Viale Concordia 1, I-26100 Cremona, Italy
[ 3 ] Cremona Hosp, Div Infect Dis, Viale Concordia 1, I-26100 Cremona, Italy
","摘要
The development of COVID-19 syndrome in anticoagulated patients, and especially their admission to intensive-care units with acute severe respiratory syndrome (SARS-CoV-2), expose them to specific problems related to their therapy, in addition to those associated with the acute viral infection. Patients on VKA hospitalized with SARS-CoV-2 show high instability of PT INR due to the variability of vitamin K metabolism, diet, fasting, co-medications, liver impairment, and heart failure. Patients on DOAC are exposed to under/over treatment caused by significant pharmacological interferences. In consideration of the pharmacological characteristics of oral anticoagulant drugs, the multiple pharmacological interactions due to the treatment of acute disease and the possible necessity of mechanical ventilation with hospitalization in intensive-care units, we suggest replacing oral anticoagulant therapies (VKA and DOAC) with parenteral heparin to avoid the risk of over/under treatment.",文献类型:Editorial Material; Early Access,INTERNAL AND EMERGENCY MEDICINE,研究方向:General & Internal Medicine
128,10.1002/jmv.25795,作者关键词:children; clinical characteristics; COVID-19; SARS-CoV-2,Program of Tianjin Science and Technology Plan ,APR 2020,Detectable SARS-CoV-2 viral RNA in feces of three children during recovery period of COVID-19 pneumonia,"作者:Zhang, TQ (Zhang, Tongqiang)[ 1,2 ] ; Cui, XJ (Cui, Xiaojian)[ 3 ] ; Zhao, X (Zhao, Xue)[ 4 ] ; Wang, JH (Wang, Jinhu)[ 5 ] ; Zheng, JF (Zheng, Jiafeng)[ 1 ] ; Zheng, GF (Zheng, Guifen)[ 6 ] ; Guo, W (Guo, Wei)[ 1 ] ; Cai, CQ (Cai, Chunquan)[ 7 ] ; He, SJ (He, Sijia)[ 8 ] ; Xu, YS (Xu, Yongsheng)[ 1 ]","Tianjin Univ, Dept Resp, Childrens Hosp Tianjin, Childrens Hosp, 238 Longyan Rd, Tianjin, Peoples R China.
George Mason Univ, Sch Syst Biol, 10900 Univ Blvd, Manassas, VA 20110 USA.
[ 1 ] Tianjin Univ, Dept Resp, Childrens Hosp Tianjin, Childrens Hosp, 238 Longyan Rd, Tianjin, Peoples R China
[ 2 ] Tianjin Med Univ, Grad Sch, Tianjin, Peoples R China
[ 3 ] Tianjin Univ, Dept Clin Lab, Childrens Hosp Tianjin, Childrens Hosp, Tianjin, Peoples R China
[ 4 ] Shenyang Coloproctol Hosp, Dept Clin Lab, Shenyang, Liaoning, Peoples R China
[ 5 ] Tianjin Univ, Dept Neonatal Surg, Childrens Hosp Tianjin, Childrens Hosp, Tianjin, Peoples R China
[ 6 ] Tianjin Univ, Dept Imaging, Childrens Hosp Tianjin, Childrens Hosp, Tianjin, Peoples R China
[ 7 ] Tianjin Univ, Dept Neurosurg, Childrens Hosp, Childrens Hosp Tianjin, Tianjin, Peoples R China
[ 8 ] George Mason Univ, Natl Ctr Biodef & Infect Dis, Sch Syst Biol, Manassas, VA 20110 USA
","摘要
Coronavirus Disease 2019 (COVID-19) is a newly emerging infectious disease caused by a novel coronavirus, severe acute respiratory syndrome coronavirus 2 (SARS-CoV-2). After its first occurrence in Wuhan of China from December 2019, COVID-19 rapidly spread around the world. According to the World Health Organization statement on 13 March 2020, there had been over 132 500 confirmed cases globally. Nevertheless, the case reports of children are rare, which results in the lack of evidence for preventing and controlling of children's infection. Here, we report three cases of SARS-CoV-2 infected children diagnosed from 3 February to 17 February 2020 in Tianjin, China. All of these three cases experienced mild illness and recovered soon after the treatment, with the nucleic acid of throat swab turning negative within 14, 11, and 7 days after diagnosis, respectively. However, after been discharged, all three cases were tested SARS-CoV-2 positive in the stool samples within 10 days, in spite of their remained negative nucleic acid in throat swab specimens. Therefore, it is necessary to be aware of the possibility of fecal-oral transmission of SARS-CoV-2 infection, especially for children cases.",文献类型:Article; Early Access,JOURNAL OF MEDICAL VIROLOGY,研究方向:Virology
129,10.1002/jmv.25809,作者关键词:COVID-19; disease severity; heart injury; laboratory indicators,National Mega Project on Major Infectious Disease Prevention ,APR 2020,"Analysis of heart injury laboratory parameters in 273 COVID-19 patients in one hospital in Wuhan, China","作者:Han, H (Han, Huan)[ 1 ] ; Xie, LL (Xie, Linlin)[ 2 ] ; Liu, R (Liu, Rui)[ 1 ] ; Yang, J (Yang, Jie)[ 1 ] ; Liu, F (Liu, Fang)[ 3,4 ] ; Wu, KL (Wu, Kailang)[ 3 ] ; Chen, L (Chen, Lang)[ 2 ] ; Hou, W (Hou, Wei)[ 2 ] ; Feng, Y (Feng, Yong)[ 2 ] ; Zhu, CL (Zhu, Chengliang)[ 1 ]","Wuhan Univ, Dept Clin Lab, Renmin Hosp, Wuhan 430060, Hubei, Peoples R China.
Wuhan Univ, Sch Basic Med Sci, State Key Lab Virol, Dept Med Microbiol, Wuhan 430071, Hubei, Peoples R China.
[ 1 ] Wuhan Univ, Dept Clin Lab, Renmin Hosp, Wuhan 430060, Hubei, Peoples R China
[ 2 ] Sch Basic Med Sci, State Key Lab Virol, Dept Med Microbiol, Wuhan, Hubei, Peoples R China
[ 3 ] Coll Life Sci, State Key Lab Virol, Dept Virol, Wuhan, Hubei, Peoples R China
[ 4 ] Wuhan Inst Biotechnol, Wuhan, Hubei, Peoples R China
","摘要
An outbreak of severe acute respiratory syndrome novel coronavirus (SARS-CoV-2) epidemic spreads rapidly worldwide. SARS-CoV-2 infection caused mildly to seriously and fatally respiratory, enteric, cardiovascular, and neurological diseases. In this study, we detected and analyzed the main laboratory indicators related to heart injury, creatine kinase isoenzyme-MB (CK-MB), myohemoglobin (MYO), cardiac troponin I (ultra-TnI), and N-terminal pro-brain natriuretic peptide (NT-proBNP), in 273 patients with COVID-19 and investigated the correlation between heart injury and severity of the disease. It was found that higher concentration in venous blood of CK-MB, MYO, ultra-TnI, and NT-proBNP were associated with the severity and case fatality rate of COVID-19. Careful monitoring of the myocardiac enzyme profiles is of great importance in reducing the complications and mortality in patients with COVID-19.",文献类型:Article; Early Access,JOURNAL OF MEDICAL VIROLOGY,研究方向:Virology
130,10.1002/jmv.25832,作者关键词:ACE2; COVID-19; SARS-CoV-2; spike protein,,APR 2020,Structural variations in human ACE2 may influence its binding with SARS-CoV-2 spike protein,"作者:Hussain, M (Hussain, Mushtaq)[ 1 ] ; Jabeen, N (Jabeen, Nusrat)[ 2 ] ; Raza, F (Raza, Fozia)[ 1 ] ; Shabbir, S (Shabbir, Sanya)[ 1,2 ] ; Baig, AA (Baig, Ayesha A.)[ 1 ] ; Amanullah, A (Amanullah, Anusha)[ 1 ] ; Aziz, B (Aziz, Basma)[ 1 ]","Dow Univ Hlth Sci, Dow Coll Biotechnol, Bioinformat & Mol Med Res Grp, Karachi, Pakistan.
[ 1 ] Dow Univ Hlth Sci, Dow Coll Biotechnol, Bioinformat & Mol Med Res Grp, Dow Res Inst Biotechnol & Biomed Sci, Karachi, Pakistan
[ 2 ] Univ Karachi, Dept Microbiol, Karachi, Pakistan
","摘要
The recent pandemic of COVID-19, caused by SARS-CoV-2, is unarguably the most fearsome compared with the earlier outbreaks caused by other coronaviruses, SARS-CoV and MERS-CoV. Human ACE2 is now established as a receptor for the SARS-CoV-2 spike protein. Where variations in the viral spike protein, in turn, lead to the cross-species transmission of the virus, genetic variations in the host receptor ACE2 may also contribute to the susceptibility and/or resistance against the viral infection. This study aims to explore the binding of the proteins encoded by different human ACE2 allelic variants with SARS-CoV-2 spike protein. Briefly, coding variants of ACE2 corresponding to the reported binding sites for its attachment with coronavirus spike protein were selected and molecular models of these variants were constructed by homology modeling. The models were then superimposed over the native ACE2 and ACE2-spike protein complex, to observe structural changes in the ACE2 variants and their intermolecular interactions with SARS-CoV-2 spike protein, respectively. Despite strong overall structural similarities, the spatial orientation of the key interacting residues varies in the ACE2 variants compared with the wild-type molecule. Most ACE2 variants showed a similar binding affinity for SARS-CoV-2 spike protein as observed in the complex structure of wild-type ACE2 and SARS-CoV-2 spike protein. However, ACE2 alleles, rs73635825 (S19P) and rs143936283 (E329G) showed noticeable variations in their intermolecular interactions with the viral spike protein. In summary, our data provide a structural basis of potential resistance against SARS-CoV-2 infection driven by ACE2 allelic variants.",文献类型:Article; Early Access,JOURNAL OF MEDICAL VIROLOGY,研究方向:Virology
131,10.1002/jmv.25807,作者关键词:children; COVID-19; epidemiological characteristics; SARS-CoV-2,Basic Research Project of Sichuan Province ,APR 2020,COVID-19 epidemic: Disease characteristics in children,"作者:She, JT (She, Jiatong)[ 1 ] ; Liu, LQ (Liu, Lanqin)[ 2,3 ] ; Liu, WJ (Liu, Wenjun)[ 1,2,3 ]","Southwest Med Univ, Dept Pediat, Birth Defects Clin Res Ctr Sichuan Prov, Affiliated Hosp, 25 Taiping St, Luzhou 646000, Sichuan, Peoples R China.
[ 1 ] Southwest Med Univ, Dept Pediat, Luzhou, Sichuan, Peoples R China
[ 2 ] Southwest Med Univ, Dept Pediat, Affiliated Hosp, Luzhou, Sichuan, Peoples R China
[ 3 ] Birth Defects Clin Res Ctr Sichuan Prov, Dept Pediat, Luzhou, Sichuan, Peoples R China
","摘要
In mid-December 2019, a disease caused by infection with severe acute respiratory syndrome coronavirus-2, which began in Wuhan, China, has spread throughout the country and many countries around the world. The number of children with coronavirus disease-2019 (COVID-19) has also increased significantly. Although information regarding the epidemiology of COVID-19 in children has accumulated, relevant comprehensive reports are lacking. The present article reviews the epidemiological characteristics of COVID-19 in children.",文献类型:Review; Early Access,JOURNAL OF MEDICAL VIROLOGY,研究方向:Virology
132,10.1038/s41591-020-0869-5,,Department of Science and Technology of Guangdong Province ,APR 2020,Temporal dynamics in viral shedding and transmissibility of COVID-19,"作者:He, X (He, Xi)[ 1 ] ; Lau, EHY (Lau, Eric H. Y.)[ 2 ] ; Wu, P (Wu, Peng)[ 2 ] ; Deng, XL (Deng, Xilong)[ 1 ] ; Wang, J (Wang, Jian)[ 1 ] ; Hao, XX (Hao, Xinxin)[ 2 ] ; Lau, YC (Lau, Yiu Chung)[ 2 ] ; Wong, JSY (Wong, Jessica Y.)[ 2 ] ; Guan, YJ (Guan, Yujuan)[ 1 ] ; Tan, XH (Tan, Xinghua)[ 1 ] ...更多内容","Univ Hong Kong, World Hlth Org Collaborating Ctr Infect Dis Epide, Sch Publ Hlth, Hong Kong, Peoples R China.
[ 1 ] Guangzhou Med Univ, Guangzhou Peoples Hosp 8, Guangzhou, Peoples R China
[ 2 ] Univ Hong Kong, World Hlth Org Collaborating Ctr Infect Dis Epide, Sch Publ Hlth, Hong Kong, Peoples R China
","摘要
We report temporal patterns of viral shedding in 94 patients with laboratory-confirmed COVID-19 and modeled COVID-19 infectiousness profiles from a separate sample of 77 infector-infectee transmission pairs. We observed the highest viral load in throat swabs at the time of symptom onset, and inferred that infectiousness peaked on or before symptom onset. We estimated that 44% (95% confidence interval, 25-69%) of secondary cases were infected during the index cases' presymptomatic stage, in settings with substantial household clustering, active case finding and quarantine outside the home. Disease control measures should be adjusted to account for probable substantial presymptomatic transmission.

Presymptomatic transmission of SARS-CoV-2 is estimated to account for a substantial proportion of COVID-19 cases.",文献类型:Article; Early Access,NATURE MEDICINE,研究方向:Biochemistry & Molecular Biology; Cell Biology; Research & Experimental Medicine
133,10.1007/s12250-020-00221-6,,National Natural Science Foundation of China,APR 2020,Computational Identification of Small Interfering RNA Targets in SARS-CoV-2,"作者:Chen, W (Chen, Wei)[ 1,2 ] ; Feng, PM (Feng, Pengmian)[ 1 ] ; Liu, KW (Liu, Kewei)[ 2 ] ; Wu, M (Wu, Meng)[ 2 ] ; Lin, H (Lin, Hao)[ 3 ]","Chengdu Univ Tradit Chinese Med, Innovat Inst Chinese Med & Pharm, Chengdu 611137, Peoples R China.
North China Univ Sci & Technol, Sch Life Sci, Ctr Genom & Computat Biol, Tangshan 063210, Peoples R China.
Univ Elect Sci & Technol China, Sch Life Sci & Technol, Ctr Informat Biol, Key Lab Neuroinformat,Minist Educ, Chengdu 610054, Peoples R China.
[ 1 ] Chengdu Univ Tradit Chinese Med, Innovat Inst Chinese Med & Pharm, Chengdu 611137, Peoples R China
[ 2 ] North China Univ Sci & Technol, Sch Life Sci, Ctr Genom & Computat Biol, Tangshan 063210, Peoples R China
[ 3 ] Univ Elect Sci & Technol China, Sch Life Sci & Technol, Ctr Informat Biol, Key Lab Neuroinformat,Minist Educ, Chengdu 610054, Peoples R China
",,文献类型:Letter; Early Access,VIROLOGICA SINICA,研究方向:Virology
