,DOI,KeyWords,fund,public_date,title,author,author info,abstract,type,jounary,category
54,10.1016/j.jfma.2020.03.002,,,出版年: APR 2020,Putting resiliency of a health system to the test: COVID-19 in Taiwan,"作者:Hsieh, VCR (Hsieh, Vivian Chia-Rong)[ 1 ]","China Med Univ, Dept Hlth Serv Adm, Taichung, Taiwan.
[ 1 ] China Med Univ, Dept Hlth Serv Adm, Taichung, Taiwan
",,文献类型:Letter,JOURNAL OF THE FORMOSAN MEDICAL ASSOCIATION,研究方向:General & Internal Medicine
55,10.1080/23744235.2020.1744711,作者关键词:Coronavirus disease 2019 (COVID-19); the novel corona virus (SARS-CoV-2); real-time reverse transcription-polymerase chain reaction (RT-PCR) assay,,出版年: JUN 2 2020,A case of imported COVID-19 diagnosed by PCR-positive lower respiratory specimen but with PCR-negative throat swabs,"作者:Hase, R (Hase, Ryota)[ 1,2 ] ; Kurita, T (Kurita, Takashi)[ 1 ] ; Muranaka, E (Muranaka, Emiri)[ 1,2 ] ; Sasazawa, H (Sasazawa, Hiroki)[ 1,2 ] ; Mito, H (Mito, Haruki)[ 1 ] ; Yano, Y (Yano, Yudai)[ 1 ]","90-1 Iidacho, Chiba, Japan.
[ 1 ] Japanese Red Cross Narita Hosp, Dept Infect Dis, Chiba, Japan
[ 2 ] Kameda Med Ctr, Dept Infect Dis, Chiba, Japan
","摘要
A 35-year-old woman presented with fever and mild diarrhoea without any respiratory symptoms 9 days after travelling to Japan from Wuhan, China. Her computed tomography scan revealed pneumonia. The first polymerase chain reaction (PCR) test on throat swab for the novel corona virus upon admission was negative. Therefore, she was treated for community-acquired pneumonia, but fever persisted. On hospital day 5, PCR test on induced sputum was positive, but a second polymerase chain reaction test on throat swab remained negative. She was discharged, fully recovered, on hospital day 12. A lower respiratory tract specimen should be obtained for better diagnosis of corona virus disease 2019, even in the absence of respiratory symptoms for patients with significant travel or exposure history.",文献类型:Article,INFECTIOUS DISEASES,研究方向:Infectious Diseases
56,10.1556/650.2020.31815,作者关键词:outbreak; pandemic; novel coronavirus; SARS-CoV-2; COVID-19; diagnostic testing; RT-PCR; high-risk patient; prognosis,,出版年: APR 2020,Diagnostic consideration and bedside estimation of the prognosis in COVID-19 patients,"作者:Anita, K (Anita, Korsos)[ 1 ] ; Szilvia, K (Szilvia, Kupcsulik)[ 1 ] ; Andras, L (Andras, Lovas)[ 1 ] ; Peter, H (Peter, Hankovszky)[ 1 ] ; Tamas, M (Tamas, Molnar)[ 1 ] ; Zsolt, S (Zsolt, Szabo)[ 1 ] ; Barna, B (Barna, Babik)[ 1 ]","Semmelweis U 6, H-6720 Szeged, Hungary.
[ 1 ] Szegedi Tudomanyegyet, Altalanos Orvostudomanyi Kar, Aneszteziol & Intenz Terapias Int, Szeged, Hungary
","摘要
In December 2019, a cluster of pneumonia cases of unknown origin occured in Wuhan, China. The identified infective agent is a novel corona virus called ""severe acute respiratory syndrome coronavirus 2"" (SARS-CoV-2) and the respiratory disease caused by this agent aquired the name ""coronavirus disease 2019"" (COVID-19). In March 2020, the World Health Organization (WHO) declared the novel coronavirus outbreak a pandemic. We reviewed the international literature regarding the novel coronavirus outbreak. Here below, we focus mainly on the diagnostic issues of COVID-19 and on the estimation of the prognosis. We detail the relevant anamnestic factors and initial examination results which serve as basics for the clinical suspicion of COVID-19. We also focus on the proper method of microbiological sampling and the relevant informations regarding diagnostic tests like the gold standard real-time reverse transcriptase polymerase chain reaction (RT-PCR) for SARS-CoV-2. We also cite the current national epidemiologic regulations of testing for novel coronavirus. In the last section, we emphasize the importance and the potential way of early identification of high-risk patients. The COVID-19 pandemic may cause substantial epidemiological and healthcare burden even in Hungary. In addition to the epidemiologic interventions aiming the deceleration of the outbreak, the early identification and the correct hospital treatment remain key issues since these may influence mortality. The chances of the critically ill patients could be improved solely by a high-quality and careful critical care. It is prudent to meet the experiences of colleagues working hard with these patients in the already heavily infected countries.",文献类型:Article,ORVOSI HETILAP,研究方向:General & Internal Medicine
57,10.1556/650.2020.31810,作者关键词:COVID-19 patients; intensive care; respiratory insufficiency; respiratory support; mechanical ventilation,,出版年: APR 2020,Practical aspects of intensive care for critically ill COVID-19 patients requiring respiratory support,"作者:Tamas, V (Tamas, Vegh)[ 1 ] ; Istvan, L (Istvan, Laszlo)[ 1 ] ; Marianna, J (Marianna, Juhasz)[ 1 ] ; Mariann, B (Mariann, Berhes)[ 1 ] ; Akos, F (Akos, Fabian)[ 1 ] ; Gyorgy, K (Gyorgy, Koszta)[ 1 ] ; Csilla, M (Csilla, Molnar)[ 1 ] ; Bela, F (Bela, Fulesdi)[ 1 ]","Nagyerdei Krt 98, H-4032 Debrecen, Hungary.
[ 1 ] Debreceni Egyet, Altalanos Orvostudomanyi Kar, Klin Kozpont, Aneszteziol & Intenz Terapias Klin, Debrecen, Hungary
","摘要
In December 2019, a novel outbreak of pneumonia was reported in Wuhan city, China. Initially, the zoonitic infection spread from human to human, causing a pandemic. This viral disease (COVID-19) can appear in a variety of forms, from asymptomatic through the spectrum of mild symptoms to severe respiratory failure, requiring intensive care. Caring for this latter group of patients puts a significant burden on health care. The purpose of this summary is to present the practical aspects of intensive care for patients requiring respiratory support and mechanical ventilation.",文献类型:Article,ORVOSI HETILAP,研究方向:General & Internal Medicine
58,10.1556/650.2020.31818,作者关键词:COVID-19; pathology; forensic pathology; autopsy,,出版年: APR 2020,"Role of duties related to COVID-19 suspected, probable and confirmed fatality cases","作者:Bence, FC (Bence, Farkas Csaba)[ 1 ] ; David, P (David, Petretei)[ 2 ] ; Gergely, B (Gergely, Babinszky)[ 3 ] ; Gabor, D (Gabor, Dudas)[ 3 ] ; Gergo, S (Gergo, Szabo)[ 4 ] ; Csaba, B (Csaba, Bognar)[ 5 ] ; Marta, J (Marta, Jackel)[ 1 ]","Robert Karoly Krt 44, H-1134 Budapest, Hungary.
[ 1 ] Magyar Honvedseg Egeszsegugyi Kozpont, Patol & Korszovettani Diagnosztikai Osztaly, Budapest, Hungary
[ 2 ] Nemzeti Kozszolgalati Egyet, Rendeszettudomanyi Kar, Budapest, Hungary
[ 3 ] Magyar Honvedseg Egeszsegugyi Kozpont, Mobil Biol Lab, Budapest, Hungary
[ 4 ] Bajcsy Zsilinszky Korhaz, Kozponti Aneszteziol Intenz Terapias & Surgossegi, Budapest, Hungary
[ 5 ] Terrorelharitasi Kozpont, CBRN Osztaly, Budapest, Hungary
","摘要
The outbreak caused by SARS-CoV-2 beta-coronavirus, first identified in Wuhan, China, was declared a pandemic by the World Health Organization on 11th March, 2020. In Hungary, the first confirmed COVID-19 case was reported on 4th March, 2020, and on 15th March, the first fatality related to the infection was announced. At the moment of the latter event, there was no central, standardized guideline, which could explain the necessary precautions, and provide an unequivocal description on how to handle the dead body. The procedure of transportation, storage, occurent autopsy or final disposition of the deceased raise a lot of questions, especially on how to carry out these tasks. Legislation related to infectious diseases and decedent management in general do not provide enough information on how to perform duties in a COVID-19 fatality case. The chief medical officer suspended the execution of autopsies, except in cases of unnatural death, since 19th March, however, the transportation and storage of fatalities can still be a problem. The Department of Pathology of the Healthcare Professional College of the Ministry of Human capacities published a procedure on recommended post-mortem duties on 21st March, but the suggested protocols only represent a narrow spectrum of international recommendations. Therefore supplementation may be necessary. Sadly, post-mortem protocols, in spite of their importance, are also underrepresented in the international literature. A further problem, wich makes adoptability difficult, is that available foreign guidelines and algorithms are optimized for different legislation, and organisations, resources not available in our country. In this article, besides providing a summary of literature, we would also like to make practical recommendations which may increase the safety of healthcare providers participating in the treatment or pathological duties with COVID-19 suspected, probable and confirmed cases.",文献类型:Article,ORVOSI HETILAP,研究方向:General & Internal Medicine
59,10.1016/j.jacr.2020.02.008,作者关键词:Coronavirus; COVID-19; pneumonia; infection control; safety,,出版年: APR 2020,Coronavirus (COVID-19) Outbreak: What the Department of Radiology Should Know,"作者:Kooraki, S (Kooraki, Soheil)[ 1 ] ; Hosseiny, M (Hosseiny, Melina)[ 2 ] ; Myers, L (Myers, Lee)[ 3 ] ; Gholamrezanezhad, A (Gholamrezanezhad, Ali)[ 3 ]","Univ Sothern Calif, Keck Sch Med, Dept Radiol, Div Emergency Radiol, 1500 San Pablo St, Los Angeles, CA 90033 USA.
[ 1 ] Univ Southern Calif, Keck Sch Med, Los Angeles, CA 90007 USA
[ 2 ] Univ Calif Los Angeles, David Geffen Sch Med, Dept Radiol Sci, Los Angeles, CA 90095 USA
[ 3 ] Univ Sothern Calif, Keck Sch Med, Dept Radiol, Div Emergency Radiol, 1500 San Pablo St, Los Angeles, CA 90033 USA
","摘要
In December 2019, a novel coronavirus (COVID-19) pneumonia emerged in Wuhan, China. Since then, this highly contagious COVID-19 has been spreading worldwide, with a rapid rise in the number of deaths. Novel COVID-19-infected pneumonia (NCIP) is characterized by fever, fatigue, dry cough, and dyspnea. A variety of chest imaging features have been reported, similar to those found in other types of coronavirus syndromes. The purpose of the present review is to briefly discuss the known epidemiology and the imaging findings of coronavirus syndromes, with a focus on the reported imaging findings of NCIP. Moreover, the authors review precautions and safety measures for radiology department personnel to manage patients with known or suspected NCIP. Implementation of a robust plan in the radiology department is required to prevent further transmission of the virus to patients and department staff members.",文献类型:Article,JOURNAL OF THE AMERICAN COLLEGE OF RADIOLOGY,"研究方向:Radiology, Nuclear Medicine & Medical Imaging"
60,10.14336/AD.2020.0228,作者关键词:COVID-19; ACE2 negative; mesenchymal stem cells; cell transplantation; immunomodulation; function recovery,National Key Research and Development Program of China ,出版年: APR 2020,Transplantation of ACE2(-) Mesenchymal Stem Cells Improves the Outcome of Patients with COVID-19 Pneumonia,"作者:Leng, ZK (Leng, Zikuan)[ 1,5 ] ; Zhu, RJ (Zhu, Rongjia)[ 2 ] ; Hou, W (Hou, Wei)[ 3 ] ; Feng, YM (Feng, Yingmei)[ 3 ] ; Yang, YL (Yang, Yanlei)[ 4 ] ; Han, Q (Han, Qin)[ 2 ] ; Shan, GL (Shan, Guangliang)[ 2 ] ; Meng, FY (Meng, Fanyan)[ 1 ] ; Du, DS (Du, Dongshu)[ 1 ] ; Wang, SH (Wang, Shihua)[ 2 ] ...更多内容","Shanghai Univ, Sch Life Sci, Shanghai, Peoples R China.
Capital Med Univ, Beijing YouAn Hosp, Beijing, Peoples R China.
Univ North Texas, Hlth Sci Ctr, Ft Worth, TX 76107 USA.
Zhengzhou Univ, Affiliated Hosp 1, Zhengzhou, Peoples R China.
[ 1 ] Shanghai Univ, Sch Life Sci, Shanghai, Peoples R China
[ 2 ] Chinese Acad Med Sci, Peking Union Med Coll, Inst Basic Med Sci, Sch Basic Med, Beijing, Peoples R China
[ 3 ] Capital Med Univ, Beijing YouAn Hosp, Beijing, Peoples R China
[ 4 ] Chinese Acad Med Sci & Peking Union Med Coll, Peking Union Med Coll Hosp, Dept Rheumatol & Clin Immunol, Beijing, Peoples R China
[ 5 ] Zhengzhou Univ, Dept Orthopaed, Affiliated Hosp 1, Zhengzhou, Peoples R China
[ 6 ] Qingdao Univ, Sch Basic Med, Inst Stem Cell & Regenerat Med, Qingdao, Shandong, Peoples R China
[ 7 ] Xi An Jiao Tong Univ, Dept Orthopaed, Affiliated Hosp 2, Xian, Peoples R China
[ 8 ] Zhengzhou Univ, Dept Neurosurg, Affiliated Hosp 1, Zhengzhou, Peoples R China
[ 9 ] UNESCO, Execut Comm Antiaging & Dis Prevent Framework Sci, Paris, France
[ 10 ] Int Soc Aging & Dis, Ft Worth, TX USA
[ 11 ] Tel Aviv Univ, Geriatr Med Ctr Shmuel Harofe, Sackler Sch Med, Tel Aviv, Israel
[ 12 ] Univ Hong Kong, Li Ka Shing Fac Med, Sch Biomed Sci, Hong Kong, Peoples R China
[ 13 ] Univ Macau, Inst Chinese Med Sci, Taipa, Macao, Peoples R China
[ 14 ] Russian Acad Sci, Inst Biol, Komi Sci Ctr, Syktyvkar, Russia
[ 15 ] Univ Valencia, Dept Pediat Obstet & Gynecol, Valencia, Spain
[ 16 ] Maharishi Markandeshwar Deemed Univ, Mullana Ambala, India
[ 17 ] Inha Univ, Dept Biol Sci, Incheon, South Korea
[ 18 ] Kings Coll London, Fac Life Sci & Med, London, England
[ 19 ] Univ Palermo, Dept Biomed Neurosci & Adv Diagnost, Palermo, Italy
[ 20 ] Univ North Texas, Hlth Sci Ctr, Ft Worth, TX 76107 USA
","摘要
A coronavirus (HCoV-19) has caused the novel coronavirus disease (COVID-19) outbreak in Wuhan, China. Preventing and reversing the cytokine storm may be the key to save the patients with severe COVID-19 pneumonia. Mesenchymal stem cells (MSCs) have been shown to possess a comprehensive powerful immunomodulatory function. This study aims to investigate whether MSC transplantation improves the outcome of 7 enrolled patients with COVID-19 pneumonia in Beijing YouAn Hospital, China, from Jan 23, 2020 to Feb 16, 2020. The clinical outcomes, as well as changes of inflammatory and immune function levels and adverse effects of 7 enrolled patients were assessed for 14 days after MSC injection. MSCs could cure or significantly improve the functional outcomes of seven patients without observed adverse effects. The pulmonary function and symptoms of these seven patients were significantly improved in 2 days after MSC transplantation. Among them, two common and one severe patient were recovered and discharged in 10 days after treatment. After treatment, the peripheral lymphocytes were increased, the C-reactive protein decreased, and the overactivated cytokine-secreting immune cells CXCR3+CD4+ T cells, CXCR3+CD8+ T cells, and CXCR3+ NK cells disappeared in 3-6 days. In addition, a group of CD14+CD11c+CD11b(mid) regulatory DC cell population dramatically increased. Meanwhile, the level of TNF-alpha was significantly decreased, while IL-10 increased in MSC treatment group compared to the placebo control group. Furthermore, the gene expression profile showed MSCs were ACE2 - and TMPRSS2 - which indicated MSCs are free from COVID-19 infection. Thus, the intravenous transplantation of MSCs was safe and effective for treatment in patients with COVID-19 pneumonia, especially for the patients in critically severe condition.",文献类型:Article,AGING AND DISEASE,研究方向:Geriatrics & Gerontology
61,10.1007/s12098-020-03263-6,作者关键词:2019-nCOV; SARS-CoV-2; COVID-19; Pneumonia; Review,,出版年: APR 2020,A Review of Coronavirus Disease-2019 (COVID-19),"作者:Singhal, T (Singhal, Tanu)[ 1 ]","Kokilaben Dhirubhai Ambani Hosp & Med Res Inst, Dept Pediat & Infect Dis, Mumbai, Maharashtra, India.
[ 1 ] Kokilaben Dhirubhai Ambani Hosp & Med Res Inst, Dept Pediat & Infect Dis, Mumbai, Maharashtra, India
","摘要
There is a new public health crises threatening the world with the emergence and spread of 2019 novel coronavirus (2019-nCoV) or the severe acute respiratory syndrome coronavirus 2 (SARS-CoV-2). The virus originated in bats and was transmitted to humans through yet unknown intermediary animals in Wuhan, Hubei province, China in December 2019. There have been around 96,000 reported cases of coronavirus disease 2019 (COVID-2019) and 3300 reported deaths to date (05/03/2020). The disease is transmitted by inhalation or contact with infected droplets and the incubation period ranges from 2 to 14 d. The symptoms are usually fever, cough, sore throat, breathlessness, fatigue, malaise among others. The disease is mild in most people; in some (usually the elderly and those with comorbidities), it may progress to pneumonia, acute respiratory distress syndrome (ARDS) and multi organ dysfunction. Many people are asymptomatic. The case fatality rate is estimated to range from 2 to 3%. Diagnosis is by demonstration of the virus in respiratory secretions by special molecular tests. Common laboratory findings include normal/ low white cell counts with elevated C-reactive protein (CRP). The computerized tomographic chest scan is usually abnormal even in those with no symptoms or mild disease. Treatment is essentially supportive; role of antiviral agents is yet to be established. Prevention entails home isolation of suspected cases and those with mild illnesses and strict infection control measures at hospitals that include contact and droplet precautions. The virus spreads faster than its two ancestors the SARS-CoV and Middle East respiratory syndrome coronavirus (MERS-CoV), but has lower fatality. The global impact of this new epidemic is yet uncertain.",文献类型:Review,INDIAN JOURNAL OF PEDIATRICS,研究方向:Pediatrics
62,e00127-20,作者关键词:2019-nCoV; SARS coronavirus; angiotensin-converting enzyme 2; animal reservoir; cross-species transmission; human-to-human transmission,"United States Department of Health & Human Services
National Institutes of Health (NIH) - USA",出版年: APR 2020,Receptor Recognition by the Novel Coronavirus from Wuhan: an Analysis Based on Decade-Long Structural Studies of SARS Coronavirus,"作者:Wan, YS (Wan, Yushun)[ 1 ] ; Shang, J (Shang, Jian)[ 1 ] ; Graham, R (Graham, Rachel)[ 2 ] ; Baric, RS (Baric, Ralph S.)[ 2 ] ; Li, F (Li, Fang)[ 1 ]","Univ Minnesota, Coll Vet Med, Dept Vet & Biomed Sci, St Paul, MN 55108 USA.
[ 1 ] Univ Minnesota, Coll Vet Med, Dept Vet & Biomed Sci, St Paul, MN 55108 USA
[ 2 ] Univ N Carolina, Dept Epidemiol, Chapel Hill, NC 27515 USA
","摘要
Recently, a novel coronavirus (2019-nCoV) has emerged from Wuhan, China, causing symptoms in humans similar to those caused by severe acute respiratory syndrome coronavirus (SARS-CoV). Since the SARS-CoV outbreak in 2002, extensive structural analyses have revealed key atomic-level interactions between the SARS-CoV spike protein receptor-binding domain (RBD) and its host receptor angiotensin-converting enzyme 2 (ACE2), which regulate both the cross-species and human-to-human transmissions of SARS-CoV. Here, we analyzed the potential receptor usage by 2019-nCoV, based on the rich knowledge about SARS-CoV and the newly released sequence of 2019-nCoV. First, the sequence of 2019-nCoV RBD, including its receptor-binding motif (RBM) that directly contacts ACE2, is similar to that of SARS-CoV, strongly suggesting that 2019-nCoV uses ACE2 as its receptor. Second, several critical residues in 2019-nCoV RBM (particularly GIn493) provide favorable interactions with human ACE2, consistent with 2019-nCoV's capacity for human cell infection. Third, several other critical residues in 2019-nCoV RBM (particularly Asn501) are compatible with, but not ideal for, binding human ACE2, suggesting that 2019-nCoV has acquired some capacity for human-to-human transmission. Last, while phylogenetic analysis indicates a bat origin of 2019-nCoV, 2019-nCoV also potentially recognizes ACE2 from a diversity of animal species (except mice and rats), implicating these animal species as possible intermediate hosts or animal models for 2019-nCoV infections. These analyses provide insights into the receptor usage, cell entry, host cell infectivity and animal origin of 2019-nCoV and may help epidemic surveillance and preventive measures against 2019-nCoV.

IMPORTANCE The recent emergence of Wuhan coronavirus (2019-nCoV) puts the world on alert. 2019-nCoV is reminiscent of the SARS-CoV outbreak in 2002 to 2003. Our decade-long structural studies on the receptor recognition by SARS-CoV have identified key interactions between SARS-CoV spike protein and its host receptor angiotensin-converting enzyme 2 (ACE2), which regulate both the cross-species and human-tohuman transmissions of SARS-CoV. One of the goals of SARS-CoV research was to build an atomic-level iterative framework of virus-receptor interactions to facilitate epidemic surveillance, predict species-specific receptor usage, and identify potential animal hosts and animal models of viruses. Based on the sequence of 2019-nCoV spike protein, we apply this predictive framework to provide novel insights into the receptor usage and likely host range of 2019-nCoV. This study provides a robust test of this reiterative framework, providing the basic, translational, and public health research communities with predictive insights that may help study and battle this novel 2019-nCoV.",文献类型:Article,JOURNAL OF VIROLOGY,研究方向:Virology
63,10.34172/aim.2020.08,作者关键词:COVID-19; Disease outbreaks; Health Policy; Pandemics; Quarantine; Viruses,,出版年: APR 2020,Efficacy of Mass Quarantine as Leverage of Health System Governance During COVID-19 Outbreak: A Mini Policy Review,"作者:Taghrir, MH (Taghrir, Mohammad Hossein)[ 1 ] ; Akbarialiabad, H (Akbarialiabad, Hossein)[ 1 ] ; Marzaleh, MA (Marzaleh, Milad Ahmadi)[ 2 ]","Shiraz Univ Med Sci, Sch Med, Student Res Comm, Shiraz, Iran.
[ 1 ] Shiraz Univ Med Sci, Student Res Comm, Shiraz, Iran
[ 2 ] Shiraz Univ Med Sci, Hlth Human Resources Res Ctr, Sch Management & Med Informat, Dept Hlth Disasters & Emergencies,Student Res Com, Shiraz, Iran
","摘要
On January 23, 2020, the Chinese government announced the city lockdown of Wuhan. Since then, there have been controversial debates among experts about the efficacy of mass quarantine, the oldest and probably one of the most effective methods for controlling infectious disease outbreaks. The impact of health policymaking section of health system governance becomes visible to all stakeholders and the public in such emergency contexts. The success and failure of such policies should be evaluated in order to find the proper course of action for the local and international communities. In this review, we aim to investigate the efficacy of mass quarantine in China during the coronavirus disease 2019 (COVID-19) pandemic. We found good quality evidence for the effectiveness of mass quarantine during the current stage of COVID-19 pandemic, and these strategies seem to have been highly effective in controlling the spread of the disease.",文献类型:Review,ARCHIVES OF IRANIAN MEDICINE,研究方向:General & Internal Medicine
64,10.34172/aim.2020.09,作者关键词:COVID-19 virus; Epidemiology; Review,Longgang Science and Technology Development Foundation ,出版年: APR 2020,Epidemiology and Clinical Characteristics of COVID-19,"作者:Huang, XY (Huang, Xiaoyi)[ 1 ] ; Wei, FX (Wei, Fengxiang)[ 2 ] ; Hu, L (Hu, Liang)[ 2 ] ; Wen, LJ (Wen, Lijuan)[ 2 ] ; Chen, K (Chen, Ken)[ 1 ]","Guangdong Pharmaceut Univ, Sch Nursing, 283 Jianghai Ave, Guangzhou, Peoples R China.
[ 1 ] Guangdong Pharmaceut Univ, Sch Nursing, 283 Jianghai Ave, Guangzhou, Peoples R China
[ 2 ] Shenzhen Longgang Dist Matern & Child Healthcare, Shenzhen 518172, Peoples R China
","摘要
Since December 2019, there has been an outbreak of a novel coronavirus (COVID-19) infection in Wuhan, China. Meanwhile, the outbreak also drew attention and concern from the World Health Organization (WHO). COVID-19 is another human infectious disease caused by coronavirus. The transmission of COVID-19 is potent and the infection rate is fast. Since there is no specific drug for COVID-19, the treatment is mainly symptomatic supportive therapy. In addition, it should be pointed out that patients with severe illness need more aggressive treatment and meticulous care. Recently, accurate RNA detection has been decisive for the diagnosis of COVID-19. The development of highly sensitive RT-PCR has facilitated epidemiological studies that provide insight into the prevalence, seasonality, clinical manifestations and course of COVID-19 infection. In this review, we summarize the epidemiology and characteristics of COVID-19.",文献类型:Review,ARCHIVES OF IRANIAN MEDICINE,研究方向:General & Internal Medicine
