,DOI,KeyWords,fund,public_date,title,author,author info,abstract,type,jounary,category
171,10.1016/j.joim.2020.02.005,作者关键词:2019-nCoV; Wuhan coronavirus; Drugs; Chinese herbal; Pneumonia; Natural compounds; Molecular docking; Network pharmacology,Shanghai Leading Talent Grants in Medicine ,出版年: MAR 2020,In silico screening of Chinese herbal medicines with the potential to directly inhibit 2019 novel coronavirus,"作者:Zhang, DH (Zhang, Deng-hai)[ 1 ] ; Wu, KL (Wu, Kun-lun)[ 2 ] ; Zhang, X (Zhang, Xue)[ 1 ] ; Deng, SQ (Deng, Sheng-qiong)[ 3 ] ; Peng, B (Peng, Bin)[ 1 ]","Secondary Mil Med Univ, Shanghai Pudong Gongli Hosp, Shanghai Hlth Commiss Key Lab Artificial Intellig, Sino French Cooperat Cent Lab, Shanghai 200135, Peoples R China.
[ 1 ] Secondary Mil Med Univ, Shanghai Pudong Gongli Hosp, Shanghai Hlth Commiss Key Lab Artificial Intellig, Sino French Cooperat Cent Lab, Shanghai 200135, Peoples R China
[ 2 ] Secondary Mil Med Univ, Shanghai Pudong Gongli Hosp, Dept Tradit Chinese Med, Shanghai 200135, Peoples R China
[ 3 ] Secondary Mil Med Univ, Shanghai Pudong Gongli Hosp, Dept Res Affair Management, Shanghai 200135, Peoples R China
","摘要
Objective: In this study we execute a rational screen to identify Chinese medical herbs that are commonly used in treating viral respiratory infections and also contain compounds that might directly inhibit 2019 novel coronavirus (2019-nCoV), an ongoing novel coronavirus that causes pneumonia.

Methods: There were two main steps in the screening process. In the first step we conducted a literature search for natural compounds that had been biologically confirmed as against sever acute respiratory syndrome coronavirus or Middle East respiratory syndrome coronavirus. Resulting compounds were cross-checked for listing in the Traditional Chinese Medicine Systems Pharmacology Database. Compounds meeting both requirements were subjected to absorption, distribution, metabolism and excretion (ADME) evaluation to verify that oral administration would be effective. Next, a docking analysis was used to test whether the compound had the potential for direct 2019-nCoV protein interaction. In the second step we searched Chinese herbal databases to identify plants containing the selected compounds. Plants containing 2 or more of the compounds identified in our screen were then checked against the catalogue for classic herbal usage. Finally, network pharmacology analysis was used to predict the general in vivo effects of each selected herb.

Results: Of the natural compounds screened, 13 that exist in traditional Chinese medicines were also found to have potential anti-2019-nCoV activity. Further, 125 Chinese herbs were found to contain 2 or more of these 13 compounds. Of these 125 herbs, 26 are classically catalogued as treating viral respiratory infections. Network pharmacology analysis predicted that the general in vivo roles of these 26 herbal plants were related to regulating viral infection, immune/inflammation reactions and hypoxia response.

Conclusion: Chinese herbal treatments classically used for treating viral respiratory infection might contain direct anti-2019-nCoV compounds. (C) 2020 Shanghai Changhai Hospital. Published by Elsevier B.V. All rights reserved.",文献类型:Article,JOURNAL OF INTEGRATIVE MEDICINE-JIM,研究方向:Integrative & Complementary Medicine
172,10.4103/1995-7645.277795,,,出版年: MAR 2020,Novel coronavirus (2019-nCoV) update: What we know and what is unknown,"作者:Fasina, FO (Fasina, Folorunso Oludayo)[ 1,2 ]","Food & Agr Org United Nations FAO ECTAD, Emergency Ctr Transboundary Anim Dis, Dar Es Salaam 14111, Tanzania.
Univ Pretoria, Dept Vet Trop Dis, ZA-0110 Onderstepoort, South Africa.
[ 1 ] Food & Agr Org United Nations FAO ECTAD, Emergency Ctr Transboundary Anim Dis, Dar Es Salaam 14111, Tanzania
[ 2 ] Univ Pretoria, Dept Vet Trop Dis, ZA-0110 Onderstepoort, South Africa
",,文献类型:Editorial Material,ASIAN PACIFIC JOURNAL OF TROPICAL MEDICINE,"研究方向:Public, Environmental & Occupational Health; Tropical Medicine"
173,10.1016/j.jhin.2020.01.010,,,出版年: MAR 2020,Preparedness and proactive infection control measures against the emerging novel coronavirus in China,"作者:Cheng, VCC (Cheng, V. C. C.)[ 1,2 ] ; Wong, SC (Wong, S-C.)[ 2 ] ; To, KKW (To, K. K. W.)[ 3 ] ; Ho, PL (Ho, P. L.)[ 3 ] ; Yuen, KY (Yuen, K-Y.)[ 3 ]","Univ Hong Kong, Dept Microbiol, Hong Kong, Peoples R China.
[ 1 ] Queen Mary Hosp, Dept Microbiol, Hong Kong, Peoples R China
[ 2 ] Queen Mary Hosp, Infect Control Team, Hong Kong West Cluster, Hong Kong, Peoples R China
[ 3 ] Univ Hong Kong, Dept Microbiol, Hong Kong, Peoples R China
",,文献类型:Letter,JOURNAL OF HOSPITAL INFECTION,"研究方向:Public, Environmental & Occupational Health; Infectious Diseases"
174,10.1038/d41573-020-00016-0,,National Natural Science Foundation of China,出版年: MAR 2020,Therapeutic options for the 2019 novel coronavirus (2019-nCoV),"作者:Li, GD (Li, Guangdi)[ 1 ] ; De Clercq, E (De Clercq, Erik)[ 2 ]","Cent South Univ, Xiangya Sch Publ Hlth, Dept Epidemiol & Hlth Stat, Changsha, Peoples R China.
Katholieke Univ Leuven, Rega Inst Med Res, Dept Microbiol Immunol & Transplantat, Leuven, Belgium.
[ 1 ] Cent South Univ, Xiangya Sch Publ Hlth, Dept Epidemiol & Hlth Stat, Changsha, Peoples R China
[ 2 ] Katholieke Univ Leuven, Rega Inst Med Res, Dept Microbiol Immunol & Transplantat, Leuven, Belgium
","摘要
Therapeutic options in response to the 2019-nCoV outbreak are urgently needed. Here, we discuss the potential for repurposing existing antiviral agents to treat 2019-nCoV infection (now known as COVID-19), some of which are already moving into clinical trials.",文献类型:Editorial Material,NATURE REVIEWS DRUG DISCOVERY,研究方向:Biotechnology & Applied Microbiology; Pharmacology & Pharmacy
175,10.1111/tmi.13383,作者关键词:COVID-19; Epidemic; SARS-CoV2; Wuhan; 2019-nCoV,,出版年: MAR 2020,The COVID-19 epidemic,"作者:Velavan, TP (Velavan, Thirumalaisamy P.)[ 1,2,3 ] ; Meyer, CG (Meyer, Christian G.)[ 1,2,3 ]","Inst Trop Med, Wilhelmstr 27, D-72074 Tubingen, Germany.
[ 1 ] Univ Klinikum Tubingen, Inst Trop Med, Tubingen, Germany
[ 2 ] Vietnamese German Ctr Med Res, Hanoi, Vietnam
[ 3 ] Duy Tan Univ, Fac Med, Da Nang, Vietnam
",,文献类型:Editorial Material,TROPICAL MEDICINE & INTERNATIONAL HEALTH,"研究方向:Public, Environmental & Occupational Health; Tropical Medicine"
176,10.1016/S2215-0366(20)30047-X,,National Key R&D Program of China ,出版年: MAR 2020,"The mental health of medical workers in Wuhan, China dealing with the 2019 novel coronavirus","作者:Kang, LJ (Kang, Lijun)[ 1 ] ; Li, Y (Li, Yi)[ 2 ] ; Hu, SH (Hu, Shaohua)[ 3 ] ; Chen, M (Chen, Min)[ 4 ] ; Yang, C (Yang, Can)[ 1 ] ; Yang, BX (Yang, Bing Xiang)[ 5 ] ; Wang, Y (Wang, Ying)[ 1 ] ; Hu, JB (Hu, Jianbo)[ 3 ] ; Lai, JB (Lai, Jianbo)[ 3 ] ; Ma, XC (Ma, Xiancang)[ 6 ] ...更多内容","Wuhan Univ, RenMin Hosp, Dept Psychiat, Wuhan 430060, Peoples R China.
[ 1 ] Wuhan Univ, RenMin Hosp, Dept Psychiat, Wuhan 430060, Peoples R China
[ 2 ] Wuhan Mental Hlth Ctr, Wuhan, Peoples R China
[ 3 ] Zhejiang Univ, Affiliated Hosp 1, Sch Med, Dept Psychiat, Hangzhou, Peoples R China
[ 4 ] Huazhong Univ Sci & Technol, Sch Comp Sci & Technol, Wuhan, Peoples R China
[ 5 ] Wuhan Univ, Sch Hlth Sci, Wuhan, Peoples R China
[ 6 ] Xi An Jiao Tong Univ, Affiliated Hosp 1, Dept Psychiat, Xian, Peoples R China
[ 7 ] Shanghai Jiao Tong Univ, Sch Med, Shanghai Mental Hlth Ctr, Shanghai, Peoples R China
[ 8 ] Peking Univ, Hosp 6, Natl Clin Res Ctr Mental Disorders, Inst Mental Hlth,NHC Key Lab Mental Hlth, Beijing, Peoples R China
",,文献类型:Letter,LANCET PSYCHIATRY,研究方向:Psychiatry
177,10.5811/westjem.2020.1.46760,,,出版年: MAR 2020,2019-nCoV: The Identify-Isolate-Inform (3I) Tool Applied to a Novel Emerging Coronavirus,"作者:Koenig, KL (Koenig, Kristi L.)[ 1,2 ] ; Bey, CK (Bey, Christian K.)[ 3 ] ; McDonald, EC (McDonald, Eric C.)[ 4 ]","Hlth & Human Serv Agcy, Cty San Diego, Emergency Med Serv, 6255 Mission Gorge Rd, San Diego, CA 92120 USA.
[ 1 ] Hlth & Human Serv Agcy, Cty San Diego, Emergency Med Serv, 6255 Mission Gorge Rd, San Diego, CA 92120 USA
[ 2 ] Univ Calif Irvine, Dept Emergency Med, Orange, CA 92668 USA
[ 3 ] Univ Calif San Diego, La Jolla, CA 92093 USA
[ 4 ] Hlth & Human Serv Agcy, Cty San Diego, Publ Hlth Serv, San Diego, CA 92120 USA
","摘要
2019 Novel Coronavirus (2019-nCoV) is an emerging infectious disease closely related to MERS-CoV and SARS-CoV that was first reported in Wuhan City, Hubei Province, China in December 2019. As of January 2020, cases of 2019-nCoV are continuing to be reported in other Eastern Asian countries as well as in the United States, Europe, Australia, and numerous other countries. An unusually high volume of domestic and international travel corresponding to the beginning of the 2020 Chinese New Year complicated initial identification and containment of infected persons. Due to the rapidly rising number of cases and reported deaths, all countries should be considered at risk of imported 2019-nCoV. Therefore, it is essential for prehospital, clinic, and emergency department personnel to be able to rapidly assess 2019-nCoV risk and take immediate actions if indicated. The Identify-Isolate-Inform (31) Tool, originally conceived for the initial detection and management of Ebola virus and later adjusted for other infectious agents, can be adapted for any emerging infectious disease. This paper reports a modification of the 31 Tool for use in the initial detection and management of patients under investigation for 2019-nCoV. After initial assessment for symptoms and epidemiological risk factors, including travel to affected areas and exposure to confirmed 2019-nCoV patients within 14 days, patients are classified in a risk-stratified system. Upon confirmation of a suspected 2019-nCoV case, affected persons must immediately be placed in airborne infection isolation and the appropriate public health agencies notified. This modified 31 Tool will assist emergency and primary care clinicians, as well as out-of-hospital providers, in effectively managing persons with suspected or confirmed 2019-nCoV.",文献类型:Article,WESTERN JOURNAL OF EMERGENCY MEDICINE,研究方向:Emergency Medicine
178,10.2991/jegh.k.200218.003,作者关键词:SARS-CoV-2; MERS-CoV; COVID-19; Saudi Arabia,,出版年: MAR 2020,COVID-19 in the Shadows of MERS-CoV in the Kingdom of Saudi Arabia,"作者:Barry, M (Barry, Mazin)[ 1 ] ; Al Amri, M (Al Amri, Maha)[ 2 ] ; Memish, ZA (Memish, Ziad A.)[ 3,4,5 ]","King Saud Med City, Director Res & Innovat Ctr, Minist Hlth, Riyadh, Saudi Arabia.
Alfaisal Univ, Coll Med, Riyadh, Saudi Arabia.
Emory Univ, Rollins Sch Publ Hlth, Hubert Dept Global Hlth, Atlanta, GA 30322 USA.
[ 1 ] King Saud Univ, Coll Med, Div Infect Dis, Riyadh, Saudi Arabia
[ 2 ] King Faisal Specialist Hosp & Res Ctr, Dept Infect Dis, Riyadh, Saudi Arabia
[ 3 ] King Saud Med City, Director Res & Innovat Ctr, Minist Hlth, Riyadh, Saudi Arabia
[ 4 ] Alfaisal Univ, Coll Med, Riyadh, Saudi Arabia
[ 5 ] Emory Univ, Rollins Sch Publ Hlth, Hubert Dept Global Hlth, Atlanta, GA 30322 USA
","摘要
Middle East Respiratory Syndrome Coronavirus (MERS-CoV) has plagued the Middle East since it was first reported in 2012. Recently, at the end of December 2019, a cluster of pneumonia cases were reported from Wuhan city, Hubei Province, China, linked to a wet seafood market with a new coronavirus identified as the etiologic agent currently named SARS-CoV-2. Most cases are in Mainland China with international spread to 25 countries. The novelty of the virus, the rapid national and international spread, and the lack of therapeutic and preventative strategies have led the WHO International Health Regulation emergency committee to declare the disease as Public Health Emergency of International Concern (PHEIC) on January 30, 2020. As it relates to countries with the ongoing MERS-CoV community cases and hospital acquired infections, there will be a huge challenge for HCWs to deal with both coronaviruses, especially with the lack of standardized and approved point of care testing. This challenge will now be faced by the whole global health community dealing with COVID-19 since both coronaviruses have similar presentation. Those patients should now be tested for both MERS-CoV and SARS-CoV-2 simultaneously, and with the continuing wide international spread of SARS-CoV-2, the travel history to China in the last 14 days will be of less significance (C) 2020 The Authors. Published by Atlantis Press International B.V.",文献类型:Editorial Material,JOURNAL OF EPIDEMIOLOGY AND GLOBAL HEALTH,"研究方向:Public, Environmental & Occupational Health"
179,10.1016/j.jinf.2020.01.014,,,出版年: MAR 2020,"Emergence of a novel coronavirus causing respiratory illness from Wuhan, China","作者:Tang, JW (Tang, Julian W.)[ 1,2 ] ; Tambyah, PA (Tambyah, Paul A.)[ 3 ] ; Hui, DSC (Hui, David S. C.)[ 4 ]","Univ Hosp Leicester NHS Trust, Leicester Royal Infirm, Clin Microbiol, Level 5,Sandringham Bldg,Infirm Sq, Leicester LE1 5WW, Leics, England.
[ 1 ] Univ Hosp Leicester NHS Trust, Clin Microbiol, Leicester, Leics, England
[ 2 ] Univ Leicester, Resp Sci, Leicester, Leics, England
[ 3 ] Natl Univ Singapore, Dept Med, Singapore, Singapore
[ 4 ] Chinese Univ Hong Kong, Dept Med & Therapeut, Hong Kong, Peoples R China
",,文献类型:Letter,JOURNAL OF INFECTION,研究方向:Infectious Diseases
180,10.1016/S0140-6736(20)30260-9,,Health and Medical Research Fund from the Government of the Hong Kong Special Administrative Region ,出版年: FEB 29 2020,"Nowcasting and forecasting the potential domestic and international spread of the 2019-nCoV outbreak originating in Wuhan, China: a modelling study","作者:Wu, JT (Wu, Joseph T.)[ 1 ] ; Leung, K (Leung, Kathy)[ 1 ] ; Leung, GM (Leung, Gabriel M.)[ 1 ]","Univ Hong Kong, Sch Publ Hlth, Li Ka Shing Fac Med, Hong Kong, Peoples R China.
[ 1 ] Univ Hong Kong, Li Ka Shing Fac Med, Sch Publ Hlth, WHO Collaborating Ctr Infect Dis Epidemiol & Cont, Hong Kong, Peoples R China
","摘要
Background Since Dec 31, 2019, the Chinese city of Wuhan has reported an outbreak of atypical pneumonia caused by the 2019 novel coronavirus (2019-nCoV). Cases have been exported to other Chinese cities, as well as internationally, threatening to trigger a global outbreak. Here, we provide an estimate of the size of the epidemic in Wuhan on the basis of the number of cases exported from Wuhan to cities outside mainland China and forecast the extent of the domestic and global public health risks of epidemics, accounting for social and non-pharmaceutical prevention interventions.

Methods We used data from Dec 31, 2019, to Jan 28, 2020, on the number of cases exported from Wuhan internationally (known days of symptom onset from Dec 25, 2019, to Jan 19, 2020) to infer the number of infections in Wuhan from Dec 1, 2019, to Jan 25, 2020. Cases exported domestically were then estimated. We forecasted the national and global spread of 2019-nCoV, accounting for the effect of the metropolitan-wide quarantine of Wuhan and surrounding cities, which began Jan 23-24, 2020. We used data on monthly flight bookings from the Official Aviation Guide and data on human mobility across more than 300 prefecture-level cities in mainland China from the Tencent database. Data on confirmed cases were obtained from the reports published by the Chinese Center for Disease Control and Prevention. Serial interval estimates were based on previous studies of severe acute respiratory syndrome coronavirus (SARS-CoV). A susceptible-exposed-infectious-recovered metapopulation model was used to simulate the epidemics across all major cities in China. The basic reproductive number was estimated using Markov Chain Monte Carlo methods and presented using the resulting posterior mean and 95% credibile interval (CrI).

Findings In our baseline scenario, we estimated that the basic reproductive number for 2019-nCoV was 2.68 (95% CrI 2.47-2.86) and that 75 815 individuals (95% CrI 37 304-130 330) have been infected in Wuhan as of Jan 25, 2020. The epidemic doubling time was 6.4 days (95% CrI 5.8-7.1). We estimated that in the baseline scenario, Chongqing, Beijing, Shanghai, Guangzhou, and Shenzhen had imported 461 (95% CrI 227-805), 113 (57-193), 98 (49-168), 111 (56-191), and 80 (40-139) infections from Wuhan, respectively. If the transmissibility of 2019-nCoV were similar everywhere domestically and over time, we inferred that epidemics are already growing exponentially in multiple major cities of China with a lag time behind the Wuhan outbreak of about 1-2 weeks.

Interpretation Given that 2019-nCoV is no longer contained within Wuhan, other major Chinese cities are probably sustaining localised outbreaks. Large cities overseas with close transport links to China could also become outbreak epicentres, unless substantial public health interventions at both the population and personal levels are implemented immediately. Independent self-sustaining outbreaks in major cities globally could become inevitable because of substantial exportation of presymptomatic cases and in the absence of large-scale public health interventions. Preparedness plans and mitigation interventions should be readied for quick deployment globally. Copyright (C) 2020 Elsevier Ltd. All rights reserved.",文献类型:Article,LANCET,研究方向:General & Internal Medicine
181,10.1007/s00259-020-04735-9,作者关键词:2019 novel coronavirus pneumonia; COVID-19; SARS-CoV-2; Infection; Imaging features; Computed tomography; Ground glass opacification,,出版年: MAY 2020,Imaging and clinical features of patients with 2019 novel coronavirus SARS-CoV-2,"作者:Xu, X (Xu, Xi)[ 1 ] ; Yu, CC (Yu, Chengcheng)[ 2 ] ; Qu, J (Qu, Jing)[ 2 ] ; Zhang, LG (Zhang, Lieguang)[ 2 ] ; Jiang, SF (Jiang, Songfeng)[ 2 ] ; Huang, DY (Huang, Deyang)[ 2 ] ; Chen, BH (Chen, Bihua)[ 2 ] ; Zhang, ZP (Zhang, Zhiping)[ 2 ] ; Guan, WH (Guan, Wanhua)[ 2 ] ; Ling, ZK (Ling, Zhoukun)[ 2 ] ...更多内容","Jinan Univ, Dept Med Imaging Ctr, Affiliated Hosp 1, 613,Huangpu Rd West, Guangzhou 510630, Guangdong, Peoples R China.
Guangzhou Med Univ, Guangzhou Peoples Hosp 8, Dept Radiol, 8,Huaying Rd, Guangzhou 510060, Guangdong, Peoples R China.
[ 1 ] Jinan Univ, Dept Med Imaging Ctr, Affiliated Hosp 1, 613,Huangpu Rd West, Guangzhou 510630, Guangdong, Peoples R China
[ 2 ] Guangzhou Med Univ, Guangzhou Peoples Hosp 8, Dept Radiol, 8,Huaying Rd, Guangzhou 510060, Guangdong, Peoples R China
","摘要
Background The pneumonia caused by the 2019 novel coronavirus (SARS-CoV-2, also called 2019-nCoV) recently break out in Wuhan, China, and was named as COVID-19. With the spread of the disease, similar cases have also been confirmed in other regions of China. We aimed to report the imaging and clinical characteristics of these patients infected with SARS-CoV-2 in Guangzhou, China. Methods All patients with laboratory-identified SARS-CoV-2 infection by real-time polymerase chain reaction (PCR) were collected between January 23, 2020, and February 4, 2020, in a designated hospital (Guangzhou Eighth People's Hospital). This analysis included 90 patients (39 men and 51 women; median age, 50 years (age range, 18-86 years). All the included SARS-CoV-2-infected patients underwent non-contrast enhanced chest computed tomography (CT). We analyzed the clinical characteristics of the patients, as well as the distribution characteristics, pattern, morphology, and accompanying manifestations of lung lesions. In addition, after 1-6 days (mean 3.5 days), follow-up chest CT images were evaluated to assess radiological evolution. Findings The majority of infected patients had a history of exposure in Wuhan or to infected patients and mostly presented with fever and cough. More than half of the patients presented bilateral, multifocal lung lesions, with peripheral distribution, and 53 (59%) patients had more than two lobes involved. Of all included patients, COVID-19 pneumonia presented with ground glass opacities in 65 (72%), consolidation in 12 (13%), crazy paving pattern in 11 (12%), interlobular thickening in 33 (37%), adjacent pleura thickening in 50 (56%), and linear opacities combined in 55 (61%). Pleural effusion, pericardial effusion, and lymphadenopathy were uncommon findings. In addition, baseline chest CT did not show any abnormalities in 21 patients (23%), but 3 patients presented bilateral ground glass opacities on the second CT after 3-4 days. Conclusion SARS-CoV-2 infection can be confirmed based on the patient's history, clinical manifestations, imaging characteristics, and laboratory tests. Chest CT examination plays an important role in the initial diagnosis of the novel coronavirus pneumonia. Multiple patchy ground glass opacities in bilateral multiple lobular with periphery distribution are typical chest CT imaging features of the COVID-19 pneumonia.",文献类型:Article,EUROPEAN JOURNAL OF NUCLEAR MEDICINE AND MOLECULAR IMAGING,"研究方向:Radiology, Nuclear Medicine & Medical Imaging"
182,24,作者关键词:Novel coronavirus; Mathematical model; Basic reproduction number; Next generation matrix; Transmissibility,Xiamen New Coronavirus Prevention and Control Emergency Tackling Special Topic Program ,出版年: FEB 28 2020,A mathematical model for simulating the phase-based transmissibility of a novel coronavirus,"作者:Chen, TM (Chen, Tian-Mu)[ 1 ] ; Rui, J (Rui, Jia)[ 1 ] ; Wang, QP (Wang, Qiu-Peng)[ 1 ] ; Zhao, ZY (Zhao, Ze-Yu)[ 1 ] ; Cui, JA (Cui, Jing-An)[ 2 ] ; Yin, L (Yin, Ling)[ 3 ]","Xiamen Univ, Sch Publ Hlth, State Key Lab Mol Vaccinol & Mol Diagnost, 4221-117 South Xiangan Rd, Xiamen, Fujian, Peoples R China.
[ 1 ] Xiamen Univ, Sch Publ Hlth, State Key Lab Mol Vaccinol & Mol Diagnost, 4221-117 South Xiangan Rd, Xiamen, Fujian, Peoples R China
[ 2 ] Beijing Univ Civil Engn & Architecture, Sch Sci, Dept Math, Beijing, Peoples R China
[ 3 ] Chinese Acad Sci, Shenzhen Inst Adv Technol, Shenzhen, Guangdong, Peoples R China
","摘要
Background As reported by the World Health Organization, a novel coronavirus (2019-nCoV) was identified as the causative virus of Wuhan pneumonia of unknown etiology by Chinese authorities on 7 January, 2020. The virus was named as severe acute respiratory syndrome coronavirus 2 (SARS-CoV-2) by International Committee on Taxonomy of Viruses on 11 February, 2020. This study aimed to develop a mathematical model for calculating the transmissibility of the virus. Methods In this study, we developed a Bats-Hosts-Reservoir-People transmission network model for simulating the potential transmission from the infection source (probably be bats) to the human infection. Since the Bats-Hosts-Reservoir network was hard to explore clearly and public concerns were focusing on the transmission from Huanan Seafood Wholesale Market (reservoir) to people, we simplified the model as Reservoir-People (RP) transmission network model. The next generation matrix approach was adopted to calculate the basic reproduction number (R-0) from the RP model to assess the transmissibility of the SARS-CoV-2. Results The value of R-0 was estimated of 2.30 from reservoir to person and 3.58 from person to person which means that the expected number of secondary infections that result from introducing a single infected individual into an otherwise susceptible population was 3.58. Conclusions Our model showed that the transmissibility of SARS-CoV-2 was higher than the Middle East respiratory syndrome in the Middle East countries, similar to severe acute respiratory syndrome, but lower than MERS in the Republic of Korea.",文献类型:Article,INFECTIOUS DISEASES OF POVERTY,研究方向:Infectious Diseases; Parasitology; Tropical Medicine
183,10.3855/jidc.12530,作者关键词:COVID-19; global outbreak; challenge,,出版年: MAR 2020,Global outbreak of COVID-19: a new challenge?,"作者:Musa, TH (Musa, Taha Hussein)[ 1,2,3 ] ; Ahmad, T (Ahmad, Tauseef)[ 1,2 ] ; Khan, M (Khan, Muhammad)[ 4 ] ; Haroon (Haroon)[ 5 ] ; Wei, PM (Wei, Pingmin)[ 1,2 ]","Southeast Univ, Sch Publ Hlth, Dept Epidemiol & Hlth Stat, 87 Dingjiaqiao Rd, Nanjing 210009, Peoples R China.
[ 1 ] Southeast Univ, Sch Publ Hlth, Dept Epidemiol & Hlth Stat, 87 Dingjiaqiao Rd, Nanjing 210009, Peoples R China
[ 2 ] Southeast Univ, Sch Publ Hlth, Minist Educ, Key Lab Environm Med Engn, Nanjing, Peoples R China
[ 3 ] Darfur Coll, Biomed Res Inst, Nyala, Sudan
[ 4 ] Hazara Univ Mansehra, Ctr Human Genet, Dept Genet, Khyber Pakhtunkhwa, Pakistan
[ 5 ] Northwest Univ, Coll Life Sci, Xian, Peoples R China
",,文献类型:Editorial Material,JOURNAL OF INFECTION IN DEVELOPING COUNTRIES,研究方向:Infectious Diseases
184,10.1056/NEJMc2001272,,,出版年: FEB 27 2020,Importation and Human-to-Human Transmission of a Novel Coronavirus in Vietnam,"作者:Phan, LT (Phan, Lan T.)[ 1 ] ; Nguyen, TV (Nguyen, Thuong V.)[ 1 ] ; Luong, QC (Luong, Quang C.)[ 1 ]","Pasteur Inst Ho Chi Minh City, Ho Chi Minh City, Vietnam.
[ 1 ] Pasteur Inst Ho Chi Minh City, Ho Chi Minh City, Vietnam
","摘要
The authors describe transmission of 2019-nCoV from a father, who had flown with his wife from Wuhan to Hanoi, to the son, who met his father and mother in central Vietnam and shared a hotel room with them for 3 days. The findings suggest that the incubation period in the son may have been 3 days or less.",文献类型:Letter,NEW ENGLAND JOURNAL OF MEDICINE,研究方向:General & Internal Medicine
