,DOI,KeyWords,fund,public_date,title,author,author info,abstract,type,jounary,category
105,10.1001/jamanetworkopen.2020.3976,,National Key Research and Development Program of China ,出版年: MAR 23 2020,Factors Associated With Mental Health Outcomes Among Health Care Workers Exposed to Coronavirus Disease 2019,"作者:Lai, JB (Lai, Jianbo)[ 1 ] ; Ma, SM (Ma, Simeng)[ 2 ] ; Wang, Y (Wang, Ying)[ 2 ] ; Cai, ZX (Cai, Zhongxiang)[ 2 ] ; Hu, JB (Hu, Jianbo)[ 1 ] ; Wei, N (Wei, Ning)[ 1 ] ; Wu, J (Wu, Jiang)[ 3 ] ; Du, H (Du, Hui)[ 4 ] ; Chen, TT (Chen, Tingting)[ 5 ] ; Li, RT (Li, Ruiting)[ 2 ] ...更多内容","Zhejiang Univ, Affiliated Hosp 1, Dept Psychiat, Sch Med, 79 Qingchun Rd, Hangzhou 310003, Peoples R China.
Wuhan Univ, Dept Psychiat, Renmin Hosp, 238 Jiefang Rd, Wuhan 430060, Peoples R China.
[ 1 ] Zhejiang Univ, Affiliated Hosp 1, Dept Psychiat, Sch Med, 79 Qingchun Rd, Hangzhou 310003, Peoples R China
[ 2 ] Wuhan Univ, Dept Psychiat, Renmin Hosp, 238 Jiefang Rd, Wuhan 430060, Peoples R China
[ 3 ] Wuhan Youfu Hosp, Dept Psychiat, Wuhan, Peoples R China
[ 4 ] Jingmen 2 Peoples Hosp, Dept Psychiat, Jingmen, Peoples R China
[ 5 ] Wuhan Wudong Hosp, Dept Psychiat, Wuhan, Peoples R China
[ 6 ] Zhejiang Univ, Affiliated Hosp 1, Dept Nursing, Sch Med, Hangzhou, Peoples R China
","摘要
Importance Health care workers exposed to coronavirus disease 2019 (COVID-19) could be psychologically stressed. Objective To assess the magnitude of mental health outcomes and associated factors among health care workers treating patients exposed to COVID-19 in China. Design, Settings, and Participants This cross-sectional, survey-based, region-stratified study collected demographic data and mental health measurements from 1257 health care workers in 34 hospitals from January 29, 2020, to February 3, 2020, in China. Health care workers in hospitals equipped with fever clinics or wards for patients with COVID-19 were eligible. Main Outcomes and Measures The degree of symptoms of depression, anxiety, insomnia, and distress was assessed by the Chinese versions of the 9-item Patient Health Questionnaire, the 7-item Generalized Anxiety Disorder scale, the 7-item Insomnia Severity Index, and the 22-item Impact of Event Scale-Revised, respectively. Multivariable logistic regression analysis was performed to identify factors associated with mental health outcomes. Results A total of 1257 of 1830 contacted individuals completed the survey, with a participation rate of 68.7%. A total of 813 (64.7%) were aged 26 to 40 years, and 964 (76.7%) were women. Of all participants, 764 (60.8%) were nurses, and 493 (39.2%) were physicians; 760 (60.5%) worked in hospitals in Wuhan, and 522 (41.5%) were frontline health care workers. A considerable proportion of participants reported symptoms of depression (634 [50.4%]), anxiety (560 [44.6%]), insomnia (427 [34.0%]), and distress (899 [71.5%]). Nurses, women, frontline health care workers, and those working in Wuhan, China, reported more severe degrees of all measurements of mental health symptoms than other health care workers (eg, median [IQR] Patient Health Questionnaire scores among physicians vs nurses: 4.0 [1.0-7.0] vs 5.0 [2.0-8.0]; P = .007; median [interquartile range {IQR}] Generalized Anxiety Disorder scale scores among men vs women: 2.0 [0-6.0] vs 4.0 [1.0-7.0]; P < .001; median [IQR] Insomnia Severity Index scores among frontline vs second-line workers: 6.0 [2.0-11.0] vs 4.0 [1.0-8.0]; P < .001; median [IQR] Impact of Event Scale-Revised scores among those in Wuhan vs those in Hubei outside Wuhan and those outside Hubei: 21.0 [8.5-34.5] vs 18.0 [6.0-28.0] in Hubei outside Wuhan and 15.0 [4.0-26.0] outside Hubei; P < .001). Multivariable logistic regression analysis showed participants from outside Hubei province were associated with lower risk of experiencing symptoms of distress compared with those in Wuhan (odds ratio [OR], 0.62; 95% CI, 0.43-0.88; P = .008). Frontline health care workers engaged in direct diagnosis, treatment, and care of patients with COVID-19 were associated with a higher risk of symptoms of depression (OR, 1.52; 95% CI, 1.11-2.09; P = .01), anxiety (OR, 1.57; 95% CI, 1.22-2.02; P < .001), insomnia (OR, 2.97; 95% CI, 1.92-4.60; P < .001), and distress (OR, 1.60; 95% CI, 1.25-2.04; P < .001). Conclusions and Relevance In this survey of heath care workers in hospitals equipped with fever clinics or wards for patients with COVID-19 in Wuhan and other regions in China, participants reported experiencing psychological burden, especially nurses, women, those in Wuhan, and frontline health care workers directly engaged in the diagnosis, treatment, and care for patients with COVID-19.

This cross-sectional study assesses the magnitude of mental health consequences and associated factors among health care workers treating patients exposed to coronavirus disease 2019 (COVID-19) in China.

Question What factors are associated with mental health outcomes among health care workers in China who are treating patients with coronavirus disease 2019 (COVID-19)? Findings In this cross-sectional study of 1257 health care workers in 34 hospitals equipped with fever clinics or wards for patients with COVID-19 in multiple regions of China, a considerable proportion of health care workers reported experiencing symptoms of depression, anxiety, insomnia, and distress, especially women, nurses, those in Wuhan, and front-line health care workers directly engaged in diagnosing, treating, or providing nursing care to patients with suspected or confirmed COVID-19. Meaning These findings suggest that, among Chinese health care workers exposed to COVID-19, women, nurses, those in Wuhan, and front-line health care workers have a high risk of developing unfavorable mental health outcomes and may need psychological support or interventions.",文献类型:Article,JAMA NETWORK OPEN,研究方向:General & Internal Medicine
106,e204006,,,出版年: MAR 23 2020,Exercising Heart and Head in Managing Coronavirus Disease 2019 in Wuhan,"作者:Perlis, RH (Perlis, Roy H.)[ 1,2 ]","Massachusetts Gen Hosp, Ctr Quantitat Hlth, Simches Res Bldg,185 Cambridge St,Second Floor, Boston, MA 02114 USA.
Massachusetts Gen Hosp, Dept Psychiat, Simches Res Bldg,185 Cambridge St,Second Floor, Boston, MA 02114 USA.
[ 1 ] Massachusetts Gen Hosp, Ctr Quantitat Hlth, Simches Res Bldg,185 Cambridge St,Second Floor, Boston, MA 02114 USA
[ 2 ] Massachusetts Gen Hosp, Dept Psychiat, Simches Res Bldg,185 Cambridge St,Second Floor, Boston, MA 02114 USA
",,文献类型:Editorial Material,JAMA NETWORK OPEN,研究方向:General & Internal Medicine
107,10.1111/jpc.14871,,,出版年: APR 2020,Three children who recovered from novel coronavirus 2019 pneumonia,"作者:Lou, XX (Lou, Xin Xia)[ 1 ] ; Shi, CX (Shi, Cai Xiao)[ 1 ] ; Zhou, CC (Zhou, Chong Chen)[ 1 ] ; Tian, YS (Tian, Yu Sheng)[ 1 ]","Zhengzhou Univ, Henan Childrens Hosp, Childrens Hosp, Zhengzhou, Peoples R China.
[ 1 ] Zhengzhou Univ, Henan Childrens Hosp, Childrens Hosp, Zhengzhou, Peoples R China
",,文献类型:Editorial Material,JOURNAL OF PAEDIATRICS AND CHILD HEALTH,研究方向:Pediatrics
108,10.1002/jmv.25762,作者关键词:homology; nucleotide; reference sequence; SARS-CoV-2; variation,Emergency Science and Technology Plan for Novel Coronavirus Infection of Anqing ,出版年: JUN 2020,The establishment of reference sequence for SARS-CoV-2 and variation analysis,"作者:Wang, CT (Wang, Changtai)[ 1,2,3 ] ; Liu, ZP (Liu, Zhongping)[ 1,2 ] ; Chen, ZX (Chen, Zixiang)[ 2 ] ; Huang, X (Huang, Xin)[ 2 ] ; Xu, MY (Xu, Mengyuan)[ 1,2 ] ; He, TF (He, Tengfei)[ 1,2 ] ; Zhang, ZH (Zhang, Zhenhua)[ 1,2,4 ]","Anhui Med Univ, Dept Infect Dis, Hosp 2, Furong Rd 678, Hefei 230601, Anhui, Peoples R China.
[ 1 ] Anhui Med Univ, Dept Infect Dis, Hosp 2, Furong Rd 678, Hefei 230601, Anhui, Peoples R China
[ 2 ] Anhui Med Univ, Inst Clin Virol, Hosp 2, Hefei, Peoples R China
[ 3 ] Anhui Med Univ, Dept Infect Dis, Affiliated Anqing Hosp, Anqing, Peoples R China
[ 4 ] Anhui Med Univ, Anhui Prov Lab Inflammatory & Immun Dis, Hefei, Peoples R China
","摘要
Starting around December 2019, an epidemic of pneumonia, which was named COVID-19 by the World Health Organization, broke out in Wuhan, China, and is spreading throughout the world. A new coronavirus, named severe acute respiratory syndrome coronavirus 2 (SARS-CoV-2) by the Coronavirus Study Group of the International Committee on Taxonomy of Viruses was soon found to be the cause. At present, the sensitivity of clinical nucleic acid detection is limited, and it is still unclear whether it is related to genetic variation. In this study, we retrieved 95 full-length genomic sequences of SARAS-CoV-2 strains from the National Center for Biotechnology Information and GISAID databases, established the reference sequence by conducting multiple sequence alignment and phylogenetic analyses, and analyzed sequence variations along the SARS-CoV-2 genome. The homology among all viral strains was generally high, among them, 99.99% (99.91%-100%) at the nucleotide level and 99.99% (99.79%-100%) at the amino acid level. Although overall variation in open-reading frame (ORF) regions is low, 13 variation sites in 1a, 1b, S, 3a, M, 8, and N regions were identified, among which positions nt28144 in ORF 8 and nt8782 in ORF 1a showed mutation rate of 30.53% (29/95) and 29.47% (28/95), respectively. These findings suggested that there may be selective mutations in SARS-COV-2, and it is necessary to avoid certain regions when designing primers and probes. Establishment of the reference sequence for SARS-CoV-2 could benefit not only biological study of this virus but also diagnosis, clinical monitoring and intervention of SARS-CoV-2 infection in the future.",文献类型:Article,JOURNAL OF MEDICAL VIROLOGY,研究方向:Virology
109,10.1002/jmv.25758,作者关键词:coronavirus; pp1ab protein; SARS; SARS-CoV-2; virus; Wuhan,Consejo Nacional de Ciencia y Tecnologia (CONACyT),出版年: JUN 2020,An exclusive 42 amino acid signature in pp1ab protein provides insights into the evolutive history of the 2019 novel human-pathogenic coronavirus (SARS-CoV-2),"作者:Cardenas-Conejo, Y (Cardenas-Conejo, Yair)[ 1 ] ; Linan-Rico, A (Linan-Rico, Andromeda)[ 2 ] ; Garcia-Rodriguez, DA (Garcia-Rodriguez, Daniel Alejandro)[ 3 ] ; Centeno-Leija, S (Centeno-Leija, Sara)[ 1 ] ; Serrano-Posada, H (Serrano-Posada, Hugo)[ 1 ]","Carretera Los Limones Loma Juarez, Colima 28629, Mexico.
[ 1 ] Univ Colima, Natl Council Sci & Technol CONACYT, Lab Agrobiotechnol, Colima, Mexico
[ 2 ] Univ Colima, Natl Council Sci & Technol CONACYT, Univ Ctr Biomed Res, Colima, Mexico
[ 3 ] Univ Colima, Lab Agrobiotechnol, Colima, Mexico
","摘要
The city of Wuhan, Hubei province, China, was the origin of a severe pneumonia outbreak in December 2019, attributed to a novel coronavirus (severe acute respiratory syndrome coronavirus 2 [SARS-CoV-2]), causing a total of 2761 deaths and 81109 cases (25 February 2020). SARS-CoV-2 belongs to genus Betacoronavirus, subgenus Sarbecovirus. The polyprotein 1ab (pp1ab) remains unstudied thoroughly since it is similar to other sarbecoviruses. In this short communication, we performed phylogenetic-structural sequence analysis of pp1ab protein of SARS-CoV-2. The analysis showed that the viral pp1ab has not changed in most isolates throughout the outbreak time, but interestingly a deletion of 8 aa in the virulence factor nonstructural protein 1 was found in a virus isolated from a Japanese patient that did not display critical symptoms. While comparing pp1ab protein with other betacoronaviruses, we found a 42 amino acid signature that is only present in SARS-CoV-2 (AS-SCoV2). Members from clade 2 of sarbecoviruses have traces of this signature. The AS-SCoV2 located in the acidic-domain of papain-like protein of SARS-CoV-2 and bat-SL-CoV-RatG13 guided us to suggest that the novel 2019 coronavirus probably emerged by genetic drift from bat-SL-CoV-RaTG13. The implication of this amino acid signature in papain-like protein structure arrangement and function is something worth to be explored.",文献类型:Article,JOURNAL OF MEDICAL VIROLOGY,研究方向:Virology
110,MAR 19 2020,,,出版年: MAR 19 2020,The Novel Coronavirus Outbreak: What We Know and What We Don't,"作者:Zhang, YZ (Zhang, Yong-Zhen)[ 1,2 ] ; Koopmans, M (Koopmans, Marion)[ 3 ] ; Yuen, KY (Yuen, Kwok Yung)[ 4 ] ; Andersen, K (Andersen, Kristian)[ 5 ] ; Perlman, S (Perlman, Stanley)[ 6 ] ; Hogue, B (Hogue, Brenda)[ 7 ] ; Eckerle, I (Eckerle, Isabella)[ 8,9 ]","Fudan Univ, Shanghai Publ Hlth Clin Ctr, Shanghai, Peoples R China.
Chinese Ctr Dis Control & Prevent, Beijing, Peoples R China.
[ 1 ] Fudan Univ, Shanghai Publ Hlth Clin Ctr, Shanghai, Peoples R China
[ 2 ] Chinese Ctr Dis Control & Prevent, Beijing, Peoples R China
[ 3 ] Erasmus MC, Rotterdam, Netherlands
[ 4 ] Univ Hong Kong, Hong Kong, Peoples R China
[ 5 ] Scripps Res, San Diego, CA USA
[ 6 ] Univ Iowa, Iowa City, IA 52242 USA
[ 7 ] Arizona State Univ, Tempe, AZ 85287 USA
[ 8 ] Univ Hosp Geneva, Ctr Emerging Viral Dis, Geneva, Switzerland
[ 9 ] Univ Geneva, Geneva, Switzerland
",,文献类型:Editorial Material,CELL,研究方向:Biochemistry & Molecular Biology; Cell Biology
111,10.1080/21645515.2020.1735227,作者关键词:Emerging coronavirus; COVID-19; vaccines; therapeutics; drugs,,MAR 2020,"COVID-19, an emerging coronavirus infection: advances and prospects in designing and developing vaccines, immunotherapeutics, and therapeutics","作者:Dhama, K (Dhama, Kuldeep)[ 1 ] ; Sharun, K (Sharun, Khan)[ 2 ] ; Tiwari, R (Tiwari, Ruchi)[ 3 ] ; Dadar, M (Dadar, Maryam)[ 4 ] ; Malik, YS (Malik, Yashpal Singh)[ 5 ] ; Singh, KP (Singh, Karam Pal)[ 1 ] ; Chaicumpa, W (Chaicumpa, Wanpen)[ 6 ]","ICAR Indian Vet Res Inst, Div Pathol, Bareilly 243122, Uttar Pradesh, India.
ICAR Indian Vet Res Inst, Div Biol Standardizat, Bareilly 243122, Uttar Pradesh, India.
[ 1 ] ICAR Indian Vet Res Inst, Div Pathol, Bareilly 243122, Uttar Pradesh, India
[ 2 ] ICAR Indian Vet Res Inst, Div Surg, Bareilly, Uttar Pradesh, India
[ 3 ] Deen Dayal Upadhayay Pashu Chikitsa Vigyan Vishwa, Dept Vet Microbiol & Immunol, Coll Vet Sci, Mathura, India
[ 4 ] AREEO, Razi Vaccine & Serum Res Inst, Karaj, Iran
[ 5 ] ICAR Indian Vet Res Inst, Div Biol Standardizat, Bareilly 243122, Uttar Pradesh, India
[ 6 ] Mahidol Univ, Ctr Res Excellence Therapeut Prot & Antibody Engn, Dept Parasitol, Fac Med,Siriraj Hosp, Bangkok, Thailand
","摘要
The novel coronavirus infection (COVID-19 or Coronavirus disease 2019) that emerged from Wuhan, Hubei province of China has spread to many countries worldwide. Efforts have been made to develop vaccines against human coronavirus (CoV) infections such as MERS and SARS in the past decades. However, to date, no licensed antiviral treatment or vaccine exists for MERS and SARS. Most of the efforts for developing CoV vaccines and drugs target the spike glycoprotein or S protein, the major inducer of neutralizing antibodies. Although a few candidates have shown efficacy in in vitro studies, not many have progressed to randomized animal or human trials, hence may have limited use to counter COVID-19 infection. This article highlights ongoing advances in designing vaccines and therapeutics to counter COVID-19 while also focusing on such experiences and advances as made with earlier SARS- and MERS-CoVs, which together could enable efforts to halt this emerging virus infection.",文献类型:Review; Early Access,HUMAN VACCINES & IMMUNOTHERAPEUTICS,研究方向:Biotechnology & Applied Microbiology; Immunology
112,10.1038/s41591-020-0822-7,,Health and Medical Research Fund from the Government of the Hong Kong Special Administrative Region ,MAR 2020,"Estimating clinical severity of COVID-19 from the transmission dynamics in Wuhan, China","作者:Wu, JT (Wu, Joseph T.)[ 1 ] ; Leung, K (Leung, Kathy)[ 1 ] ; Bushman, M (Bushman, Mary)[ 2 ] ; Kishore, N (Kishore, Nishant)[ 2 ] ; Niehus, R (Niehus, Rene)[ 2 ] ; de Salazar, PM (de Salazar, Pablo M.)[ 2 ] ; Cowling, BJ (Cowling, Benjamin J.)[ 1 ] ; Lipsitch, M (Lipsitch, Marc)[ 2 ] ; Leung, GM (Leung, Gabriel M.)[ 1 ]","Univ Hong Kong, WHO Collaborating Ctr Infect Dis Epidemiol & Cont, Sch Publ Hlth, LKS Fac Med, Hong Kong, Peoples R China.
[ 1 ] Univ Hong Kong, WHO Collaborating Ctr Infect Dis Epidemiol & Cont, Sch Publ Hlth, LKS Fac Med, Hong Kong, Peoples R China
[ 2 ] Harvard TH Chan Sch Publ Hlth, Ctr Communicable Dis Dynam, Dept Epidemiol, Boston, MA USA
","摘要
As of 29 February 2020 there were 79,394 confirmed cases and 2,838 deaths from COVID-19 in mainland China. Of these, 48,557 cases and 2,169 deaths occurred in the epicenter, Wuhan. A key public health priority during the emergence of a novel pathogen is estimating clinical severity, which requires properly adjusting for the case ascertainment rate and the delay between symptoms onset and death. Using public and published information, we estimate that the overall symptomatic case fatality risk (the probability of dying after developing symptoms) of COVID-19 in Wuhan was 1.4% (0.9-2.1%), which is substantially lower than both the corresponding crude or naive confirmed case fatality risk (2,169/48,557 = 4.5%) and the approximator(1) of deaths/deaths + recoveries (2,169/2,169 + 17,572 = 11%) as of 29 February 2020. Compared to those aged 30-59 years, those aged below 30 and above 59 years were 0.6 (0.3-1.1) and 5.1 (4.2-6.1) times more likely to die after developing symptoms. The risk of symptomatic infection increased with age (for example, at similar to 4% per year among adults aged 30-60 years).",文献类型:Article; Early Access,NATURE MEDICINE,研究方向:Biochemistry & Molecular Biology; Cell Biology; Research & Experimental Medicine
113,2000266,,Finnish Institute for Health and Welfare (THL) ,出版年: MAR 19 2020,"Serological and molecular findings during SARS-CoV-2 infection: the first case study in Finland, January to February 2020","作者:Haveri, A (Haveri, Anu)[ 1 ] ; Smura, T (Smura, Teemu)[ 2 ] ; Kuivanen, S (Kuivanen, Suvi)[ 2 ] ; Osterlund, P (Osterlund, Pamela)[ 1 ] ; Hepojoki, J (Hepojoki, Jussi)[ 2,3 ] ; Ikonen, N (Ikonen, Niina)[ 1 ] ; Pitkapaasi, M (Pitkapaasi, Marjaana)[ 1 ] ; Blomqvist, S (Blomqvist, Soile)[ 1 ] ; Ronkko, E (Ronkko, Esa)[ 1 ] ; Kantele, A (Kantele, Anu)[ 4,5 ] ...更多内容","Finnish Inst Hlth & Welf THL, Dept Hlth Secur, Helsinki, Finland.
[ 1 ] Finnish Inst Hlth & Welf THL, Dept Hlth Secur, Helsinki, Finland
[ 2 ] Univ Helsinki, Dept Virol, Med, Helsinki, Finland
[ 3 ] Univ ZUrich, Vetsuisse Fac, Inst Vet Pathol, Zurich, Switzerland
[ 4 ] Helsinki Univ Hosp HUSLAB, Inflammat Ctr, Infect Dis, Helsinki, Finland
[ 5 ] Univ Helsinki, Helsinki, Finland
[ 6 ] Helsinki Univ Hosp HUSLAB, Dept Virol & Immunol, Helsinki, Finland
[ 7 ] Lapland Cent Hosp, Infect Hosp Hyg Unit, Rovaniemi, Finland
[ 8 ] Univ Helsinki, Fac Biol & Environm Sci, Helsinki, Finland
","摘要
The first case of coronavirus disease (COVID-19) in Finland was confirmed on 29 January 2020. No secondary cases were detected. We describe the clinical picture and laboratory findings 3-23 days since the first symptoms. The SARS-CoV-2/Finland/1/2020 virus strain was isolated, the genome showing a single nucleotide substitution to the reference strain from Wuhan. Neutralising antibody response appeared within 9 days along with specific IgM and IgG response, targeting particularly nucleocapsid and spike proteins.",文献类型:Article,EUROSURVEILLANCE,研究方向:Infectious Diseases
114,10.1007/s00330-020-06801-0,作者关键词:Coronavirus infections; Pneumonia; Tomography; X-ray computed,,MAR 2020,Chest CT manifestations of new coronavirus disease 2019 (COVID-19): a pictorial review,"作者:Ye, Z (Ye, Zheng)[ 1 ] ; Zhang, Y (Zhang, Yun)[ 1 ] ; Wang, Y (Wang, Yi)[ 1 ] ; Huang, ZX (Huang, Zixiang)[ 1 ] ; Song, B (Song, Bin)[ 1 ]","Sichuan Univ, West China Hosp, Dept Radiol, 37 Guoxue Alley, Chengdu 610041, Peoples R China.
[ 1 ] Sichuan Univ, West China Hosp, Dept Radiol, 37 Guoxue Alley, Chengdu 610041, Peoples R China
","摘要
Coronavirus disease 2019 (COVID-19) outbreak, first reported in Wuhan, China, has rapidly swept around the world just within a month, causing global public health emergency. In diagnosis, chest computed tomography (CT) manifestations can supplement parts of limitations of real-time reverse transcription polymerase chain reaction (RT-PCR) assay. Based on a comprehensive literature review and the experience in the frontline, we aim to review the typical and relatively atypical CT manifestations with representative COVID-19 cases at our hospital, and hope to strengthen the recognition of these features with radiologists and help them make a quick and accurate diagnosis. Key Points center dot Ground glass opacities, consolidation, reticular pattern, and crazy paving pattern are typical CT manifestations of COVID-19. center dot Emerging atypical CT manifestations, including airway changes, pleural changes, fibrosis, nodules, etc., were demonstrated in COVID-19 patients. center dot CT manifestations may associate with the progression and prognosis of COVID-19.",文献类型:Review; Early Access,EUROPEAN RADIOLOGY,"研究方向:Radiology, Nuclear Medicine & Medical Imaging"
115,10.1007/s12519-020-00354-4,作者关键词:Children; COVID-19; Novel coronavirus; 2019-nCoV; Severe; Critical ill; Wuhan,,MAR 2020,Clinical features of severe pediatric patients with coronavirus disease 2019 in Wuhan: a single center's observational study,"作者:Sun, D (Sun, Dan)[ 1,5 ] ; Li, H (Li, Hui)[ 2 ] ; Lu, XX (Lu, Xiao-Xia)[ 4 ] ; Xiao, H (Xiao, Han)[ 5 ] ; Ren, J (Ren, Jie)[ 3 ] ; Zhang, FR (Zhang, Fu-Rong)[ 3 ] ; Liu, ZS (Liu, Zhi-Sheng)[ 1 ]","Huazhong Univ Sci & Technol, Wuhan Childrens Hosp, Tongji Med Coll, Dept Neurol, Wuhan 430015, Peoples R China.
Huazhong Univ Sci & Technol, Wuhan Childrens Hosp, Tongji Med Coll, Dept Intens Care Unit, Wuhan 430015, Peoples R China.
[ 1 ] Huazhong Univ Sci & Technol, Wuhan Childrens Hosp, Tongji Med Coll, Dept Neurol, Wuhan 430015, Peoples R China
[ 2 ] Huazhong Univ Sci & Technol, Wuhan Childrens Hosp, Tongji Med Coll, Dept Hematol, Wuhan 430015, Peoples R China
[ 3 ] Huazhong Univ Sci & Technol, Wuhan Childrens Hosp, Tongji Med Coll, Dept Intens Care Unit, Wuhan 430015, Peoples R China
[ 4 ] Huazhong Univ Sci & Technol, Wuhan Childrens Hosp, Tongji Med Coll, Dept Resp, Wuhan 430015, Peoples R China
[ 5 ] Huazhong Univ & Technol, Wuhan Childrens Hosp, Tongji Med Coll, Inst Maternal & Child Hlth, Wuhan 430015, Peoples R China
","摘要
Background An outbreak of coronavirus disease 2019 (COVID-19) caused by SARS-CoV-2 was first detected in Wuhan, Hubei, China. People of all ages are susceptible to SARS-CoV-2 infection. No information on severe pediatric patients with COVID-19 has been reported. We aimed to describe the clinical features of severe pediatric patients with COVID-19. Methods We included eight severe or critically ill patients with COVID-19 who were treated at the Intensive Care Unit (ICU), Wuhan Children's Hospital from January 24 to February 24. We collected information including demographic data, symptoms, imaging data, laboratory findings, treatments and clinical outcomes of the patients with severe COVID-19. Results The onset age of the eight patients ranged from 2 months to 15 years; six were boys. The most common symptoms were polypnea (8/8), followed by fever (6/8) and cough (6/8). Chest imaging showed multiple patch-like shadows in seven patients and ground-glass opacity in six. Laboratory findings revealed normal or increased whole blood counts (7/8), increased C-reactive protein, procalcitonin and lactate dehydrogenase (6/8), and abnormal liver function (4/8). Other findings included decreased CD16 + CD56 (4/8) and Th/Ts*(1/8), increased CD3 (2/8), CD4 (4/8) and CD8 (1/8), IL-6 (2/8), IL-10 (5/8) and IFN-gamma (2/8). Treatment modalities were focused on symptomatic and respiratory support. Two critically ill patients underwent invasive mechanical ventilation. Up to February 24, 2020, three patients remained under treatment in ICU, the other five recovered and were discharged home. Conclusions In this series of severe pediatric patients in Wuhan, polypnea was the most common symptom, followed by fever and cough. Common imaging changes included multiple patch-like shadows and ground-glass opacity; and a cytokine storm was found in these patients, which appeared more serious in critically ill patients.",文献类型:Article; Early Access,WORLD JOURNAL OF PEDIATRICS,研究方向:Pediatrics
116,10.1002/jmv.25738,,,出版年: JUN 2020,The Wuhan SARS-CoV-2-What's next for China,"作者:Lu, HZ (Lu, Hongzhou)[ 1 ] ; Stratton, CW (Stratton, Charles W.)[ 2 ] ; Tang, YW (Tang, Yi-Wei)[ 3 ]","Fudan Univ, Shanghai Publ Hlth Clin Ctr, Dept Infect Dis, 2901 Caolang Hwy, Shanghai 201508, Peoples R China.
Cepheid, Danaher Diagnost Platform, 518 Fuquan N Rd, Shanghai 200325, Peoples R China.
[ 1 ] Fudan Univ, Shanghai Publ Hlth Clin Ctr, Dept Infect Dis, 2901 Caolang Hwy, Shanghai 201508, Peoples R China
[ 2 ] Vanderbilt Univ, Med Ctr, Dept Pathol Microbiol & Immunol, Nashville, TN USA
[ 3 ] Cepheid, Danaher Diagnost Platform, 518 Fuquan N Rd, Shanghai 200325, Peoples R China
",,文献类型:Editorial Material,JOURNAL OF MEDICAL VIROLOGY,研究方向:Virology
