,DOI,KeyWords,fund,public_date,title,author,author info,abstract,type,jounary,category
186,e142,作者关键词:COVID-19; SARS-CoV-2; Viral Pneumonia; Prognosis; Cohort Study; Republic of Korea,National Health Promotion Fund ,出版年: APR 6 2020,Clinical Course and Outcomes of Patients with Severe Acute Respiratory Syndrome Coronavirus 2 Infection: a Preliminary Report of the First 28 Patients from the Korean Cohort Study on COVID-19,"作者:Kim, ES (Kim, Eu Suk)[ 1 ] ; Chin, BS (Chin, Bum Sik)[ 2 ] ; Kang, CK (Kang, Chang Kyung)[ 3 ] ; Kim, NJ (Kim, Nam Joong)[ 3 ] ; Kang, YM (Kang, Yu Min)[ 4 ] ; Choi, JP (Choi, Jae-Phil)[ 5 ] ; Oh, DH (Oh, Dong Hyun)[ 5 ] ; Kim, JH (Kim, Jeong-Han)[ 6 ] ; Koh, B (Koh, Boram)[ 7 ] ; Kim, SE (Kim, Seong Eun)[ 8 ] ...更多内容","Seoul Natl Univ, Dept Internal Med, Coll Med, 103 Daehak Ro, Seoul 03080, South Korea.
[ 1 ] Seoul Natl Univ, Coll Med, Dept Internal Med, Bundang Hosp, Seongnam, South Korea
[ 2 ] Natl Med Ctr, Dept Internal Med, Div Infect Dis, Seoul, South Korea
[ 3 ] Seoul Natl Univ, Dept Internal Med, Coll Med, 103 Daehak Ro, Seoul 03080, South Korea
[ 4 ] Myongji Hosp, Dept Infect Dis, Goyang, South Korea
[ 5 ] Seoul Med Ctr, Dept Internal Med, Seoul, South Korea
[ 6 ] Armed Forces Capital Hosp, Dept Internal Med, Div Infect Dis, Seongnam, South Korea
[ 7 ] Ansung Hosp, Dept Internal Med, Gyeonggi Prov Med Ctr, Anseong, South Korea
[ 8 ] Chonnam Natl Univ, Dept Infect Dis, Med Sch, Gwangju, South Korea
[ 9 ] Chosun Univ, Coll Med, Dept Internal Med, Gwangju, South Korea
[ 10 ] Wonkwang Univ, Dept Internal Med, Sch Med, Iksan, South Korea
[ 11 ] Incheon Med Ctr, Dept Internal Med, Div Infect Dis, Incheon, South Korea
[ 12 ] Seoul Natl Univ, Div Infect Dis, Seoul Metropolitan Govt, Boramae Med Ctr, Seoul, South Korea
[ 13 ] Natl Med Ctr, Dept Pediat, Seoul, South Korea
","摘要
Background: Severe acute respiratory syndrome coronavirus 2 (SARS-CoV-2)-infected pneumonia emerged in Wuhan, China in December 2019. In this retrospective multicenter study, we investigated the clinical course and outcomes of novel coronavirus disease 2019 (COVID-19) from early cases in Republic of Korea.

Methods: All of the cases confirmed by real time polymerase chain reaction were enrolled from the 1st to the 28th patient nationwide. Clinical data were collected and analyzed for changes in clinical severity including laboratory, radiological, and virologic dynamics during the progression of illness.

Results: The median age was 40 years (range, 20-73 years) and 15 (53.6%) patients were male. The most common symptoms were cough (28.6 0 /0) and sore throat (28.6%), followed by fever (25.0%). Diarrhea was not common (10.7 0 /0). Two patients had no symptoms. Initial chest X-ray (CXR) showed infiltration in 46.4% of the patients, but computed tomography scan confirmed pneumonia in 88.9% (16/18) of the patients. Six patients (21.4%) required supplemental oxygen therapy, but no one needed mechanical ventilation. Lymphopenia was more common in severe cases. Higher level of C-reactive protein and worsening of chest radiographic score was observed during the 5-7 day period after symptom onset. Viral shedding was high from day 1 of illness, especially from the tipper respiratory tract (URT).

Conclusion: The prodromal symptoms of COVID-19 were mild and most patients did not have limitations of daily activity. Viral shedding from URT was high from the prodromal phase. Radiological pneumonia was common from the early days of illness, but it was frequently not evident in simple CXR. These findings could be plausible explanations for the easy and rapid spread of SARS-CoV-2 in the community.",文献类型:Article,JOURNAL OF KOREAN MEDICAL SCIENCE,研究方向:General & Internal Medicine
187,e140,作者关键词:Community Treatment Center; Medical Resources; SARS-CoV-2; COVID-19,,出版年: APR 6 2020,Out-of-Hospital Cohort Treatment of Coronavirus Disease 2019 Patients with Mild Symptoms in Korea: an Experience from a Single Community Treatment Center,"作者:Park, PG (Park, Peong Gang)[ 1 ] ; Kim, CH (Kim, Chang Hyup)[ 2 ] ; Heo, Y (Heo, Yoon)[ 3 ] ; Kim, TS (Kim, Tae Suk)[ 4 ] ; Park, CW (Park, Chan Woo)[ 5 ] ; Kim, CH (Kim, Choong-Hyo)[ 6 ]","Kangwon Natl Univ, Dept Neurosurg, Sch Med, 1 Gangwondaehak Ro, Chunchon 24289, South Korea.
[ 1 ] Minist Hlth & Welf, Sejong, South Korea
[ 2 ] Kangwon Natl Univ Hosp, Dept Internal Med, Chunchon, South Korea
[ 3 ] Kangwon Natl Univ Hosp, Dept Otorhinolaryngol, Chunchon, South Korea
[ 4 ] Kangwon Natl Univ, Dept Internal Med, Sch Med, Chunchon, South Korea
[ 5 ] Kangwon Natl Univ, Dept Emergency Med, Sch Med, Chunchon, South Korea
[ 6 ] Kangwon Natl Univ, Dept Neurosurg, Sch Med, 1 Gangwondaehak Ro, Chunchon 24289, South Korea
","摘要
The outbreak of Coronavirus Disease 2019 (COVID-19) caused a worldwide pandemic. Less than 6 weeks after the first confirmed cases in Korea, the patient number exceeded 5,000, which overcrowded limited hospital resources and forced confirmed patients to stay at home. To allocate medical resources efficiently, Korea implemented a novel institution for the purpose of treating patients with cohort isolation out of hospital, namely the Community Treatment Center (CTC). Herein, we report results of the initial management of patients at one of the largest CTC in Korea. A total of 309 patients were admitted to our CTC. During the first two weeks, 7 patients were transferred to the hospital because of symptom aggravation and 107 patients were discharged without any complication. Although it is a novel concept and may have some limitations, CTC may be a very cost-effective and resource-saving strategy in managing massive cases of COVID-19 or other emerging infectious diseases.",文献类型:Article,JOURNAL OF KOREAN MEDICAL SCIENCE,研究方向:General & Internal Medicine
188,10.1038/s41437-020-0314-z,,"United States Department of Health & Human Services
National Institutes of Health (NIH) - USA
NIH National Institute of General Medical Sciences (NIGMS)",出版年: MAY 2020,Considering mutational meltdown as a potential SARS-CoV-2 treatment strategy,"作者:Jensen, JD (Jensen, Jeffrey D.)[ 1 ] ; Lynch, M (Lynch, Michael)[ 1 ]","Arizona State Univ, Sch Life Sci, Tempe, AZ 85287 USA.
[ 1 ] Arizona State Univ, Sch Life Sci, Tempe, AZ 85287 USA
",,文献类型:Editorial Material,HEREDITY,研究方向:Environmental Sciences & Ecology; Evolutionary Biology; Genetics & Heredity
189,10.1002/jmv.25793,作者关键词:COVID-19 patients; medical staff; nucleic acid-negative; nucleic acid-positive; SARS-Cov-2,Clinical Research Physician Program of Tongji Medical College ,APR 2020,"Clinical characteristics of 54 medical staff with COVID-19: A retrospective study in a single center in Wuhan, China","作者:Chu, JJ (Chu, Jiaojiao)[ 1 ] ; Yang, N (Yang, Nan)[ 2 ] ; Wei, YQ (Wei, Yanqiu)[ 1 ] ; Yue, HH (Yue, Huihui)[ 1 ] ; Zhang, FQ (Zhang, Fengqin)[ 1 ] ; Zhao, JP (Zhao, Jianping)[ 1 ] ; He, L (He, Li)[ 3 ] ; Sheng, GH (Sheng, Gaohong)[ 4 ] ; Chen, P (Chen, Peng)[ 5,6 ] ; Li, G (Li, Gang)[ 7 ] ...更多内容","Huazhong Univ Sci & Technol, NHC Key Lab Resp Dis, Tongji Med Coll, Tongji Hosp,Ctr Biomed Res,Dept Resp & Crit Care, Wuhan 430030, Hubei, Peoples R China.
Huazhong Univ Sci & Technol, Tongji Med Coll, Sch Publ Hlth, Key Lab Environm & Hlth,Dept Epidemiol & Biostat, Wuhan 430030, Hubei, Peoples R China.
Huazhong Univ Sci & Technol, Tongji Hosp, Tongji Med Coll, Dept Pharm, 1095 Jiefang Ave, Wuhan 430030, Hubei, Peoples R China.
Huazhong Univ Sci & Technol, Tongji Hosp, Tongji Med Coll, Clin Res Ctr, 1095 Jiefang Ave, Wuhan 430030, Hubei, Peoples R China.
[ 1 ] Huazhong Univ Sci & Technol, Tongji Med Coll, Dept Resp & Crit Care Med, Wuhan, Hubei, Peoples R China
[ 2 ] Huazhong Univ Sci & Technol, Tongji Med Coll, Sch Publ Hlth, Dept Epidemiol & Biostat, Wuhan, Hubei, Peoples R China
[ 3 ] Jingzhou Cent Hosp, Dept Resp Med & Crit Care Med, Jingzhou, Hubei, Peoples R China
[ 4 ] Huazhong Univ Sci & Technol, Tongji Hosp, Tongji Med Coll, Dept Orthoped, Wuhan, Hubei, Peoples R China
[ 5 ] Huazhong Univ Sci & Technol, Tongji Hosp, Tongji Med Coll, Dept Internal Med,Div Cardiol, Wuhan, Hubei, Peoples R China
[ 6 ] Huazhong Univ Sci & Technol, Tongji Hosp, Tongji Med Coll, Genet Diag Ctr, Wuhan, Hubei, Peoples R China
[ 7 ] Huazhong Univ Sci & Technol, Tongji Hosp, Tongji Med Coll, Outpatient Dept Off, Wuhan, Hubei, Peoples R China
[ 8 ] Wuhan Cent Hosp, Dept Crit Med, Wuhan, Hubei, Peoples R China
[ 9 ] Wuhan Fourth Hosp, Dept Resp Med, Wuhan, Hubei, Peoples R China
[ 10 ] Huazhong Univ Sci & Technol, NHC Key Lab Resp Dis, Tongji Med Coll, Tongji Hosp,Ctr Biomed Res,Dept Resp & Crit Care, Wuhan 430030, Hubei, Peoples R China
[ 11 ] Huazhong Univ Sci & Technol, Tongji Med Coll, Dept Pharm, Wuhan, Hubei, Peoples R China
[ 12 ] Huazhong Univ Sci & Technol, Tongji Hosp, Tongji Med Coll, Dept Clin Res Ctr, Wuhan, Hubei, Peoples R China
","摘要
In December 2019, an outbreak of the severe acute respiratory syndrome coronavirus 2 (SARS-Cov-2) infection occurred in Wuhan, and rapidly spread to worldwide, which has attracted many people's concerns about the patients. However, studies on the infection status of medical personnel is still lacking. A total of 54 cases of SARS-Cov-2 infected medical staff from Tongji Hospital between 7 January and 11 February 2020 were analyzed in this retrospective study. Clinical and epidemiological characteristics were compared between different groups by statistical method. From 7 January to 11 February 2020, 54 medical staff of Tongji Hospital were hospitalized due to coronavirus disease 2019 (COVID-19). Most of them were from other clinical departments (72.2%) rather than emergency department (3.7%) or medical technology departments (18.5%). Among the 54 patients with COVID-19, the distribution of age had a significant difference between non-severe type and severe/critical cases (median age: 47 years vs 38 years; P = .0015). However, there was no statistical difference in terms of gender distribution and the first symptoms between theses two groups. Furthermore, we observed that the lesion regions in SARS-Cov-2 infected lungs with severe-/critical-type of medical staff were more likely to exhibit lesions in the right upper lobe (31.7% vs 0%; P = .028) and right lung (61% vs 18.2%; P = .012). Based on our findings with medical staff infection data, we suggest training for all hospital staff to prevent infection and preparation of sufficient protection and disinfection materials.",文献类型:Article; Early Access,JOURNAL OF MEDICAL VIROLOGY,研究方向:Virology
190,10.1007/s11428-020-00611-0,作者关键词:Severe acute respiratory syndrome coronavirus 2; Reproduction; Pneumonia; Infectious disease transmission; vertical; Infant; newborn; diseases,,APR 2020,Coronavirus disease 2019 (COVID-19) and pregnancy Overview and report of the first German case with COVID-19 and gestational diabetes,"作者:Kleinwechter, H (Kleinwechter, H.)[ 1 ] ; Laubner, K (Laubner, K.)[ 2 ]","Diabetologikum Kiel, Diabet Schwerpunktpraxis & Schulungszentrum, Alter Markt 11, D-24103 Kiel, Germany.
[ 1 ] Diabetologikum Kiel, Diabet Schwerpunktpraxis & Schulungszentrum, Alter Markt 11, D-24103 Kiel, Germany
[ 2 ] Albert Ludwigs Univ Freiburg, Univ Klinikum Freiburg, Med Fak, Abt Endokrinol & Diabetol,Klinikfur Innere Med 2, Freiburg, Germany
","摘要
Since the beginning of the coronavirus pandemic with SARS-CoV-2 (severe acute respiratory syndrome coronavirus 2) in January 2020, more than 100 cases of pregnant Chinese women have been published, including individuals with gestational diabetes (GDM). The descriptive overview reports on the clinical presentation of COVID-19 as well as on obstetric and neonatal outcome data. The main symptoms of the overall milder course of infection are fever, cough and dyspnea. So far, there is no evidence of intrauterine transmission of the virus and no evidence of breast milk transfer. Postnatal infections of infants of infected mothers are documented, but the course is usually mild. The available data are informative for preparing health professionals for the expected infections in pregnant women with the comorbidity diabetes mellitus.",文献类型:Article; Early Access,DIABETOLOGE,研究方向:Endocrinology & Metabolism
191,10.1007/s00405-020-05965-1,作者关键词:Coronavirus; COVID; COVID-19; SARS-CoV-2; Anosmia; Smell; Hyposmia; Dysgeusia; Taste; Loss; Gustatory; Olfactory; Olfaction; Infection; ENT,,APR 2020,Olfactory and gustatory dysfunctions as a clinical presentation of mild-to-moderate forms of the coronavirus disease (COVID-19): a multicenter European study,"作者:Lechien, JR (Lechien, Jerome R.)[ 1,2,3,4 ] ; Chiesa-Estomba, CM (Chiesa-Estomba, Carlos M.)[ 1,5 ] ; De Siati, DR (De Siati, Daniele R.)[ 1,6 ] ; Horoi, M (Horoi, Mihaela)[ 4 ] ; Le Bon, SD (Le Bon, Serge D.)[ 4 ] ; Rodriguez, A (Rodriguez, Alexandra)[ 4 ] ; Dequanter, D (Dequanter, Didier)[ 4 ] ; Blecic, S (Blecic, Serge)[ 7 ] ; El Afia, F (El Afia, Fahd)[ 1,3 ] ; Distinguin, L (Distinguin, Lea)[ 1,3 ] ...更多内容","YO IFOS, COVID Task Force 19, Paris, France.
Univ Mons, Fac Med, UMONS Res Inst Hlth Sci & Technol, Dept Human Anat & Expt Oncol, Mons, Belgium.
Univ Versailles St Quentin En Yvelines, Foch Hosp, Sch Med,Paris Saclay Univ, Dept Otorhinolaryngol & Head & Neck Surg,UFR Simo, Paris, France.
Univ Libre Bruxelles, Sch Med, Dept Otorhinolaryngol & Head & Neck Surg, CHU St Pierre, Brussels, Belgium.
[ 1 ] YO IFOS, COVID Task Force 19, Paris, France
[ 2 ] Univ Mons, Fac Med, UMONS Res Inst Hlth Sci & Technol, Dept Human Anat & Expt Oncol, Mons, Belgium
[ 3 ] Univ Versailles St Quentin En Yvelines, Foch Hosp, Sch Med,Paris Saclay Univ, Dept Otorhinolaryngol & Head & Neck Surg,UFR Simo, Paris, France
[ 4 ] Univ Libre Bruxelles, Sch Med, Dept Otorhinolaryngol & Head & Neck Surg, CHU St Pierre, Brussels, Belgium
[ 5 ] Hosp Univ Donostia, Dept Otorhinolaryngol Head & Neck Surg, San Sebastian, Spain
[ 6 ] Catholic Univ Louvain, Dept Otorhinolaryngol & Head & Neck Surg, CHU St Luc, Brussels, Belgium
[ 7 ] EpiCURA Hosp, Dept Neurol, Ath, Belgium
[ 8 ] Hosp Quironsalud Valencia, Dept Otorhinolaryngol Head & Neck Surg, Valencia, Spain
[ 9 ] Hosp Complex Santiago de Compostela, Dept Otolaryngol, Santiago De Compostela, Spain
[ 10 ] Ctr Hosp Univ Montreal, Div Otolaryngol Head & Neck Surg, Montreal, PQ, Canada
[ 11 ] Univ L Vanvitelli, Dept Mental & Phys Hlth & Prevent Med, Div Phoniatr & Audiol, Naples, Italy
[ 12 ] Morgagni Pierantoni Hosp, Dept Otolaryngol Head & Neck Surg, Forli, Italy
[ 13 ] EpiCURA Hosp, Dept Otolaryngol Head & Neck Surg, Baudour, Belgium
[ 14 ] CHU Ambroise Pare, Dept Otolaryngol Head & Neck Surg, Mons, Belgium
[ 15 ] CHU Ambroise Pare, Div Infect Dis, Mons, Belgium
[ 16 ] Geneva Univ Hosp HUG, Dept Otorhinolaryngol Head & Neck Surg, Rhinol Olfactol Unit, Geneva, Switzerland
[ 17 ] Univ Paris 05, Ctr Hosp St Anne, Dept Neuroradiol, DHU Neurovasc,Sorbonne Paris Cite,IMABRAIN INSERM, Paris, France
[ 18 ] GH Univ Paris Saclay, Dept Radiol, Hop R Poincare Ambroise Pare, AP HP,DMU Smart Imaging,U1179,UVSQ Paris Saclay, Paris, France
[ 19 ] Univ Mons, Fac Med, UMONS Res Inst Hlth Sci & Technol, Dept Neurosci, Mons, Belgium
[ 20 ] Padova Univ, Dept Neurosci, Audiol Unit, Treviso, Italy
[ 21 ] Univ Mons, Fac Med, UMONS Res Inst Hlth Sci & Technol, Dept Metab & Mol Biochem, Mons, Belgium
[ 22 ] Aix Marseille Univ, La Concept Univ Hosp, AP HM, Dept Otorhinolaryngol Head & Neck Surg, Marseille, France
","摘要
Objective To investigate the occurrence of olfactory and gustatory dysfunctions in patients with laboratory-confirmed COVID-19 infection. Methods Patients with laboratory-confirmed COVID-19 infection were recruited from 12 European hospitals. The following epidemiological and clinical outcomes have been studied: age, sex, ethnicity, comorbidities, and general and otolaryngological symptoms. Patients completed olfactory and gustatory questionnaires based on the smell and taste component of the National Health and Nutrition Examination Survey, and the short version of the Questionnaire of Olfactory Disorders-Negative Statements (sQOD-NS). Results A total of 417 mild-to-moderate COVID-19 patients completed the study (263 females). The most prevalent general symptoms consisted of cough, myalgia, and loss of appetite. Face pain and nasal obstruction were the most disease-related otolaryngological symptoms. 85.6% and 88.0% of patients reported olfactory and gustatory dysfunctions, respectively. There was a significant association between both disorders (p < 0.001). Olfactory dysfunction (OD) appeared before the other symptoms in 11.8% of cases. The sQO-NS scores were significantly lower in patients with anosmia compared with normosmic or hyposmic individuals (p = 0.001). Among the 18.2% of patients without nasal obstruction or rhinorrhea, 79.7% were hyposmic or anosmic. The early olfactory recovery rate was 44.0%. Females were significantly more affected by olfactory and gustatory dysfunctions than males (p = 0.001). Conclusion Olfactory and gustatory disorders are prevalent symptoms in European COVID-19 patients, who may not have nasal symptoms. The sudden anosmia or ageusia need to be recognized by the international scientific community as important symptoms of the COVID-19 infection.",文献类型:Article; Early Access,EUROPEAN ARCHIVES OF OTO-RHINO-LARYNGOLOGY,研究方向:Otorhinolaryngology
192,10.1038/s41430-020-0625-4,,,APR 2020,Nutritional management in hospital setting during SARS-CoV-2 pandemic: a real-life experience,"作者:Cintoni, M (Cintoni, Marco)[ 1 ] ; Rinninella, E (Rinninella, Emanuele)[ 2 ] ; Annetta, MG (Annetta, Maria Giuseppina)[ 3 ] ; Mele, MC (Mele, Maria Cristina)[ 4 ]","Univ Roma Tor Vergata, Scuola Specializzaz Sci Alimentaz, Via Montpellier 1, I-00133 Rome, Italy.
[ 1 ] Univ Roma Tor Vergata, Scuola Specializzaz Sci Alimentaz, Via Montpellier 1, I-00133 Rome, Italy
[ 2 ] Fdn Policlin Univ A Gemelli IRCCS, UOC Nutriz Clin, Dipartimento Sci Med & Chirurg, Largo A Gemelli 8, I-00168 Rome, Italy
[ 3 ] Fdn Policlin Univ A Gemelli IRCCS, UOC Anestesia Rianimaz Terapia Intens & Tossicol, Dipartimento Sci Emergenza Anestesiol & Rianimaz, Largo A Gemelli 8, I-00168 Rome, Italy
[ 4 ] Fdn Policlin Univ A Gemelli IRCCS, UOSA Nutriz Avanzata Oncol, Dipartimento Sci Med & Chirurg, Largo A Gemelli 8, I-00168 Rome, Italy
",,文献类型:Letter; Early Access,EUROPEAN JOURNAL OF CLINICAL NUTRITION,研究方向:Nutrition & Dietetics
193,10.1002/jmv.25815,,,APR 2020,"Sore throat in COVID-19: Comment on ""Clinical characteristics of hospitalized patients with SARS-CoV-2 infection: A single arm meta-analysis""","作者:Lovato, A (Lovato, Andrea)[ 1 ] ; Rossettini, G (Rossettini, Giacomo)[ 2 ] ; de Filippis, C (Filippis, Cosimo)[ 1 ]","Dept Neurosci, Audiol Unit, Piazzale Osped 1, I-31100 Treviso, Italy.
[ 1 ] Univ Padua, Treviso Hosp, Dept Neurosci, Audiol Unit, Treviso, Italy
[ 2 ] Univ Genoa, Dept Neurosci Rehabil Ophthalmol Genet Maternal &, Savona, Italy
",,文献类型:Letter; Early Access,JOURNAL OF MEDICAL VIROLOGY,研究方向:Virology
194,10.1002/ppul.24754,作者关键词:coronavirus; coronavirus disease 19; COVID-19; epidemic; epidemiology; infant; paediatric; SARS-CoV-2; severe acute respiratory syndrome coronavirus 2; viral infections,,APR 2020,COVID-19 infection in a paucisymptomatic infant: Raising the index of suspicion in epidemic settings,"作者:Canarutto, D (Canarutto, Daniele)[ 1,2,3 ] ; Priolo, A (Priolo, Alessio)[ 1 ] ; Russo, G (Russo, Gianni)[ 4 ] ; Pitea, M (Pitea, Marco)[ 4 ] ; Vigone, MC (Vigone, Maria Cristina)[ 4 ] ; Barera, G (Barera, Graziano)[ 4 ]","Univ Vita Salute San Raffaele, Fac Med & Surg, Via Olgettina 58, I-20132 Milan, Italy.
[ 1 ] Univ Vita Salute San Raffaele, Fac Med & Surg, Via Olgettina 58, I-20132 Milan, Italy
[ 2 ] IRCCS San Raffaele Sci Inst, Pediat Immunohematol Unit, Milan, Italy
[ 3 ] IRCCS San Raffaele Sci Inst, BMT Program, Milan, Italy
[ 4 ] IRCCS San Raffaele Sci Inst, Dept Paediat, Milan, Italy
","摘要
Few children have been reported to have been affected by novel coronavirus disease 2019 (COVID-19); it is unclear whether children are less likely to be infected or rather display fewer symptoms. We present the case of a 32-day-old boy infected by COVID-19 that presented with an upper air way infection which resolved spontaneously and did not require any therapy. We argue that in epidemic settings children presenting with any mild symptom potentially attributable to COVID-19 should be considered contagious until proven otherwise, and that management must be guided by clinical conditions.",文献类型:Article; Early Access,PEDIATRIC PULMONOLOGY,研究方向:Pediatrics; Respiratory System
195,10.1002/jmv.25785,作者关键词:acute respiratory distress syndrome (ARDS); angiotensin-converting enzyme 2 (ACE2); coronavirus disease 2019 (COVID-19); renin-angiotensin system (RAS); severe acute respiratory syndrome coronavirus 2 (SARS-CoV-2),National Natural Science Foundation of China,APR 2020,Organ-protective effect of angiotensin-converting enzyme 2 and its effect on the prognosis of COVID-19,"作者:Cheng, H (Cheng, Hao)[ 1,2 ] ; Wang, Y (Wang, Yan)[ 1,2 ] ; Wang, GQ (Wang, Gui-Qiang)[ 1,2,3,4 ]","Peking Univ, Dept Infect Dis, Hosp 1, 8 Xishiku St, Beijing 100034, Peoples R China.
[ 1 ] Peking Univ, Dept Infect Dis, Hosp 1, 8 Xishiku St, Beijing 100034, Peoples R China
[ 2 ] Peking Univ, Ctr Liver Dis, Hosp 1, Beijing, Peoples R China
[ 3 ] Zhejiang Univ, Collaborat Innovat Ctr Diag & Treatment Infect Di, Hangzhou, Zhejiang, Peoples R China
[ 4 ] Peking Univ, Int Hosp, Dept Liver Dis, Beijing, Peoples R China
","摘要
This article reviews the correlation between angiotensin-converting enzyme 2 (ACE2) and severe risk factors for coronavirus disease 2019 (COVID-19) and the possible mechanisms. ACE2 is a crucial component of the renin-angiotensin system (RAS). The classical RAS ACE-Ang II-AT1R regulatory axis and the ACE2-Ang 1-7-MasR counter-regulatory axis play an essential role in maintaining homeostasis in humans. ACE2 is widely distributed in the heart, kidneys, lungs, and testes. ACE2 antagonizes the activation of the classical RAS system and protects against organ damage, protecting against hypertension, diabetes, and cardiovascular disease. Similar to SARS-CoV, SARS-CoV-2 also uses the ACE2 receptor to invade human alveolar epithelial cells. Acute respiratory distress syndrome (ARDS) is a clinical high-mortality disease, and ACE2 has a protective effect on this type of acute lung injury. Current research shows that the poor prognosis of patients with COVID-19 is related to factors such as sex (male), age (>60 years), underlying diseases (hypertension, diabetes, and cardiovascular disease), secondary ARDS, and other relevant factors. Because of these protective effects of ACE2 on chronic underlying diseases and ARDS, the development of spike protein-based vaccine and drugs enhancing ACE2 activity may become one of the most promising approaches for the treatment of COVID-19 in the future.",文献类型:Review; Early Access,JOURNAL OF MEDICAL VIROLOGY,研究方向:Virology
196,10.1002/jmv.25786,作者关键词:COVID-19; RT-PCR,Science and Technology Planning Projects of Guangzhou City ,APR 2020,Stability issues of RT-PCR testing of SARS-CoV-2 for hospitalized patients clinically diagnosed with COVID-19,"作者:Li, YF (Li, Yafang)[ 1 ] ; Yao, L (Yao, Lin)[ 2 ] ; Li, JW (Li, Jiawei)[ 3 ] ; Chen, L (Chen, Lei)[ 1 ] ; Song, YY (Song, Yiyan)[ 4 ] ; Cai, ZF (Cai, Zhifang)[ 5 ] ; Yang, CH (Yang, Chunhua)[ 1 ]","Sun Yat Sen Univ, Affiliated Hosp 6, Dept Intens Care Unit, 26th Yuancun Rd 2, Guangzhou 510655, Peoples R China.
[ 1 ] Sun Yat Sen Univ, Affiliated Hosp 6, Dept Intens Care Unit, 26th Yuancun Rd 2, Guangzhou 510655, Peoples R China
[ 2 ] Sun Yat Sen Univ, Affiliated Hosp 6, Dept Operat & Management, Guangzhou, Peoples R China
[ 3 ] iFLYTEK Res South China, Nat Language Proc Grp, Guangzhou, Peoples R China
[ 4 ] Zhongshan Sch Med, Dept Clin Med, Guangzhou, Peoples R China
[ 5 ] Hankou Hosp Wuhan, Dept Resp, Wuhan, Peoples R China
","摘要
In this study, we collected a total of 610 hospitalized patients from Wuhan between February 2, 2020, and February 17, 2020. We reported a potentially high false negative rate of real-time reverse-transcriptase polymerase chain reaction (RT-PCR) testing for SARS-CoV-2 in the 610 hospitalized patients clinically diagnosed with COVID-19 during the 2019 outbreak. We also found that the RT-PCR results from several tests at different points were variable from the same patients during the course of diagnosis and treatment of these patients. Our results indicate that in addition to the emphasis on RT-PCR testing, clinical indicators such as computed tomography images should also be used not only for diagnosis and treatment but also for isolation, recovery/discharge, and transferring for hospitalized patients clinically diagnosed with COVID-19 during the current epidemic. These results suggested the urgent needs for the standard of procedures of sampling from different anatomic sites, sample transportation, optimization of RT-PCR, serology diagnosis/screening for SARS-CoV-2 infection, and distinct diagnosis from other respiratory diseases such as fluenza infections as well.",文献类型:Article; Early Access,JOURNAL OF MEDICAL VIROLOGY,研究方向:Virology
